noticia,link
Trump’s second term,https://edition.cnn.com//2024/11/07/politics/trump-total-power-second-term-analysis/index.html
Elon Musk,https://edition.cnn.com//2024/11/06/business/elon-musk-election-bet/index.html
Germany’s ‘traffic light crisis’,https://edition.cnn.com//2024/11/06/europe/germany-government-scholz-finance-minister-intl-latam/index.html
Inside El Salvador’s ‘worst’ prison,https://edition.cnn.com//2024/11/06/americas/el-salvador-inside-cecot-prison/index.html
Viral breakdancer Raygun,https://edition.cnn.com//2024/11/06/sport/australia-raygun-breaking-retires-intl-hnk-spt/index.html
Death-defying café in China,https://edition.cnn.com//travel/cliffside-cafe-fuzhou-china-intl-hnk/index.html
Analysis,https://edition.cnn.com//2024/11/07/politics/trump-total-power-second-term-analysis/index.html
Trump’s allies already jockeying for high-powered appointments,https://edition.cnn.com//2024/11/06/politics/transition-donald-trump-jockeying/index.html
The world’s 10 richest people got a record $64 billion richer from Trump’s reelection,https://edition.cnn.com//2024/11/07/investing/billionaires-net-worth-trump-win/index.html
Hill Republicans ready ambitious agenda as they hope for full sweep of Washington,https://edition.cnn.com//2024/11/07/politics/gop-agenda-trump-congress/index.html
The moments that led up to Trump’s return to power ,https://edition.cnn.com/https://edition.cnn.com/interactive/2024/11/politics/trump-election-comeback-cnnphotos/
Trump allies and private sector quietly prepare for mass detention of immigrants ,https://edition.cnn.com//2024/11/07/politics/trump-immigrant-detention-plans/index.html
Video,https://edition.cnn.com//2024/11/07/politics/video/trump-mass-deportation-plan-ice-sandweg-cnc-digvid
World leaders rush to pay homage to Trump as they brace for him shaking up the old-world order,https://edition.cnn.com//2024/11/06/politics/world-leaders-trump/index.html
"Gloom, nervousness and joy: What Trump’s return means for key world regions",https://edition.cnn.com//2024/11/06/world/trump-election-victory-world-view-intl/index.html
Here’s what’s at stake in the Middle East under Trump’s second term,https://edition.cnn.com//2024/11/06/middleeast/trump-middle-east-iran-israel-saudi-gulf-mime-intl/index.html
" - Source:
                CNN
",https://edition.cnn.com//videos/fast/cnni-fast
"Hours after Trump’s election, Biden moved to limit oil drilling in Arctic National Wildlife Refuge ",https://edition.cnn.com//2024/11/07/climate/anwr-drilling-trump-biden/index.html
Why Germany’s normally stable government has collapsed ,https://edition.cnn.com//2024/11/07/europe/germany-government-collapse-explainer-intl/index.html
Live Updates,https://edition.cnn.com//business/live-news/fed-meeting-november-11-07-24/index.html
Russia steps up mass drone attacks in bid to overwhelm Ukrainian defenses,https://edition.cnn.com//2024/11/07/europe/russia-ukraine-kyiv-drone-record-intl/index.html
"Israeli attacks reportedly kill dozens across Gaza, including 27 in one strike",https://edition.cnn.com//2024/11/07/middleeast/jabalya-gaza-israel-strike-intl/index.html
Mysterious black balls that washed up on Sydney beach identified,https://edition.cnn.com//2024/11/07/australia/australia-sydney-bondi-fatbergs-intl-hnk/index.html
Hurricane Rafael knocks out Cuba’s power grid,https://edition.cnn.com//2024/11/06/weather/hurricane-rafael-path-forecast-climate/index.html
Mysterious 400-year-old ‘vampire’ comes back to life with facial reconstruction ,https://edition.cnn.com//2024/11/07/science/vampire-woman-facial-reconstruction-poland/index.html
"For some Americans living in Europe, relief from some of the smaller stresses of US life makes for a more relaxed existence ",https://edition.cnn.com//travel/living-in-europe-less-stress/index.html
2024 will be first year on record to smash a warming limit scientists warned about ,https://edition.cnn.com//2024/11/06/climate/warmest-year-on-record/index.html
‘Miraculous’ Ming Dynasty jars survived WWII. Now they’ve smashed auction estimates ,https://edition.cnn.com//2024/11/07/style/ming-fish-jars-auction-scli-intl/index.html
"Workers found human bones by Hoover Dam in 2009. 15 years later, officials identified the John Doe ",https://edition.cnn.com//2024/11/07/us/john-doe-identified-michigan-dna-cold-case/index.html
Viral breakdancer Raygun will no longer compete after Olympics backlash ,https://edition.cnn.com//2024/11/06/sport/australia-raygun-breaking-retires-intl-hnk-spt/index.html
Former Pepsi boss: ‘I put the company before me’ ,https://edition.cnn.com//business/indra-nooyi-pepsi-interview-spc/index.html
Airline lost your bag? Tracking it might be about to get easier ,https://edition.cnn.com//2024/11/07/travel/apple-airtag-third-party-tracking/index.html
There’s a mysterious ‘floating’ Soviet-era city slowly crumbling into the sea ,https://edition.cnn.com//2024/11/06/climate/oil-rocks-neft-daslari-caspian-sea-city/index.html
Player’s blunder described by manager as ‘the biggest mistake I witnessed in my career’ ,https://edition.cnn.com//2024/11/07/sport/aston-villa-champions-league-tyrone-mings-spt-intl/index.html
Why brain aging can vary dramatically between people ,https://edition.cnn.com//2024/11/07/health/brain-aging-research-wellness/index.html
"‘Very rare’ 77-year-old piece of cake from Queen Elizabeth and Prince Philip’s wedding sells for $2,800 ",https://edition.cnn.com//2024/11/07/style/cake-elizabeth-philip-wedding-sale-intl-scli/index.html
"World’s oldest writing system may have its origins in mysterious, undeciphered symbols",https://edition.cnn.com//2024/11/05/science/origins-of-writing-cuneiform/index.html
LiDAR reveals a long-hidden Maya city with thousands of structures,https://edition.cnn.com//2024/11/02/science/maya-city-discovered-valeriana-mexico/index.html
Record-breaking prime number containing more than 41 million digits found by former Nvidia programmer,https://edition.cnn.com//science/world-largest-prime-number-found/index.html
Bones from a Tudor warship reveal what life was like for the crew,https://edition.cnn.com//2024/11/02/science/mary-rose-shipwreck-science-newsletter-wt/index.html
The radical passenger plane design that could reshape air travel ,https://edition.cnn.com//travel/natilus-horizon-blended-wing-aircraft-spc/index.html
This stunning city was Thailand’s first capital. Here’s what awaits visitors now,https://edition.cnn.com//travel/sukhothai-thailand-loy-krathong-festival-intl-hnk/index.html
The ancient monastery hanging from the side of a cliff,https://edition.cnn.com//travel/sumela-ancient-monastery-hanging-from-cliff-turkey/index.html
Cans of ‘fresh air’ from Lake Como on sale to tourists in Italy,https://edition.cnn.com//2024/11/04/travel/lake-como-air-cans-on-sale-intl-scli/index.html
She was determined to track down her lost crush. ‘I’m going to go and find my ginger’,https://edition.cnn.com//travel/oktoberfest-munich-airplane-chance-encounters/index.html
Why Trump’s return could spark another bout of inflation and delay interest rate cuts ,https://edition.cnn.com//2024/11/06/economy/inflation-interest-rates-donald-trump-presidency/index.html
Here’s what Trump is proposing for the economy,https://edition.cnn.com//2024/11/06/politics/heres-what-trump-is-proposing-for-the-economy/index.html
"Boeing workers vote to accept deal, end strike",https://edition.cnn.com//2024/11/04/business/boeing-strike-vote-hnk-intl/index.html
Key Boeing supplier Spirit Aero raises doubts over ability to continue as going concern,https://edition.cnn.com//2024/11/05/business/boeing-supplier-spirit-aero-going-concern/index.html
Rare letter signed by Founding Fathers expected to fetch $1 million at auction ,https://edition.cnn.com//2024/11/05/style/founding-fathers-letter-auction-scli-intl/index.html
"World’s first wooden satellite, developed in Japan, heads to space",https://edition.cnn.com//2024/11/05/style/japan-wooden-satellite-hnk-intl/index.html
What life is like in one of the most remote places on Earth,https://edition.cnn.com//2024/11/03/style/cecilia-blomdahl-remote-life-on-svalbard/index.html
Kim Kardashian gives Princess Diana’s famed cross necklace its first public outing,https://edition.cnn.com//2024/11/04/style/kim-kardashian-wears-diana-crucifix-intl-scli/index.html
Top golfer thinks Donald Trump and Elon Musk could heal the sport ,https://edition.cnn.com//2024/11/07/sport/rory-mcilroy-donald-trump-elon-musk-pga-tour-liv-golf-intl-spt/index.html
Decision day: Oregon tops season’s first College Football Playoff Top 25 rankings,https://edition.cnn.com//2024/11/05/sport/oregon-ducks-college-football-playoff-rankings-spt-intl/index.html
‘I’m not proud of it’: Jason Kelce apologizes after video shows him spiking a cellphone after fan used a homophobic slur,https://edition.cnn.com//2024/11/04/sport/jason-kelce-apologizes-after-spiking-a-cellphone-after-fan-slur-spt-intl/index.html
Soccer player killed by lightning strike during match in Peru,https://edition.cnn.com//2024/11/04/sport/peru-soccer-lightning-intl-hnk-spt/index.html
"Trump critic-turned-ally JD Vance elected vice president, offering glimpse at GOP’s potential future ",https://edition.cnn.com//2024/11/06/politics/jd-vance-elected-vice-president/index.html
Trump campaign denies and revokes journalists’ election night credentials after critical coverage,https://edition.cnn.com//2024/11/05/media/trump-revokes-journalists-election-night-credentials/index.html
Battleground states counted ballots quickly after mostly smooth Election Day vote,https://edition.cnn.com//2024/11/06/politics/battleground-states-vote-count-ballots/index.html
"Sleepy during the day? You may be at higher risk for a pre-dementia syndrome, study finds ",https://edition.cnn.com//2024/11/06/health/daytime-sleepiness-pre-dementia-syndrome-wellness/index.html
"My social media is helpful and positive. Here is how yours can be, too",https://edition.cnn.com//2024/11/06/health/social-media-healthy-intentional-wellness/index.html
How to cope with post-Election Day stress,https://edition.cnn.com//2024/11/06/health/election-day-stress-wellness/index.html
It’s ugly out there. 5 tips for talking to those with divergent views,https://edition.cnn.com//2024/11/05/health/conflict-resolution-political-divide-wellness/index.html
"Are you in perimenopause? Here’s what to look for, according to a doctor",https://edition.cnn.com//2024/10/30/health/perimenopause-menopause-wellness/index.html
TikTok sued in France over harmful content that allegedly led to two suicides ,https://edition.cnn.com//2024/11/04/tech/tiktok-sued-harmful-content-children-france/index.html
Super giant TVs are flying off store shelves,https://edition.cnn.com//2024/11/05/tech/xxl-tv-trend-best-buy/index.html
"Russia fines Google $20,000,000,000,000,000,000,000,000,000,000,000",https://edition.cnn.com//2024/10/31/tech/google-fines-russia/index.html
Apple wants its AI iPhone to turn around a sales rut. Here’s how it’s going so far,https://edition.cnn.com//2024/10/31/tech/iphone-16-ai-early-sales-numbers-earnings/index.html
41 million digits later: Inside the quest to uncover a record-breaking prime number ,https://edition.cnn.com//science/world-largest-prime-number-found/index.html
Israel plans to use lasers to shoot down incoming missiles,https://edition.cnn.com//2024/11/01/middleeast/israel-iron-beam-laser-system-intl/index.html
"‘This is what it means to be from Gaza’: Poet captures people’s stories of life, love and loss",https://edition.cnn.com//2024/10/31/style/gaza-poet-forest-of-noise-intl/index.html
Horrific details emerge of how victims died in Spain’s flash floods,https://edition.cnn.com//2024/11/01/europe/spain-floods-horror-intl/index.html
CNN Investigates,https://edition.cnn.com//2024/10/31/politics/maga-activists-preparing-undermine-election-if-trump-loses/index.html
At least 14 killed after railway station roof collapses in Serbia,https://edition.cnn.com//2024/11/01/europe/serbia-railway-station-collapse-intl/index.html
Orlando police search for motive after Halloween shootings left 2 dead in crowded nightlife district. Here’s what we know,https://edition.cnn.com//2024/11/02/us/downtown-orlando-halloween-shootings-what-we-know/index.html
"Armed group kidnaps military personnel and seizes base in central Bolivia, military says",https://edition.cnn.com//2024/11/01/americas/bolivia-cochabamba-military-base-intl/index.html
Prince William defends his ambitious plan to tackle homelessness in UK,https://edition.cnn.com//2024/11/01/uk/prince-william-homelessness-documentary-intl-scli-gbr/index.html
"Botswana’s ruling party loses election, ending 58-year rule",https://edition.cnn.com//2024/11/01/africa/botswana-party-loses-election-masisi-boko-intl/index.html
Election Day in America,https://edition.cnn.com//2024/11/05/politics/what-to-watch-election-day/index.html
Storm Rafael,https://edition.cnn.com//2024/11/05/us/tropical-storm-rafael-forecast-hurricane-hnk/index.html
Netanyahu fires defense minister,https://edition.cnn.com//2024/11/05/middleeast/netanyahu-yoav-gallant-intl-latam/index.html
Soccer player killed by lightning,https://edition.cnn.com//2024/11/04/sport/peru-soccer-lightning-intl-hnk-spt/index.html
Founding Fathers letter,https://edition.cnn.com//2024/11/05/style/founding-fathers-letter-auction-scli-intl/index.html
‘Planet 9’,https://edition.cnn.com//2024/11/04/science/planet-nine-kuiper-belt-latest-evidence/index.html
Keoghan hits back at trolls,https://edition.cnn.com//2024/11/05/entertainment/barry-keoghan-online-trolls-intl-scli/index.html
The 7 things to watch for on Election Day ,https://edition.cnn.com//2024/11/05/politics/what-to-watch-election-day/index.html
An hour-by-hour guide to election night poll closings ,https://edition.cnn.com//2024/11/05/politics/polls-close-time-election-dg/index.html
Follow the races that matter most to you ,https://edition.cnn.com/https://www.cnn.com/election/2024/your-election
See Harris and Trump’s potential paths to victory ,https://edition.cnn.com/https://www.cnn.com/election/2024/electoral-college-map?game-id=2024-PG-CNN-ratings&game-view=map
Trump is a convicted felon. Here’s why he can still vote today ,https://edition.cnn.com//2024/11/05/politics/can-trump-vote-2024-election/index.html
"Netanyahu fires Israeli Defense Minister Yoav Gallant, after months of clashes over war and politics ",https://edition.cnn.com//2024/11/05/middleeast/netanyahu-yoav-gallant-intl-latam/index.html
China to unveil J-35A stealth fighter jet as air force aims to match US aerial power,https://edition.cnn.com//2024/11/05/china/china-stealth-fighter-jet-j-35a-intl-hnk/index.html
China is building new villages on its remote Himalayan border. Some appear to have crossed the line,https://edition.cnn.com//2024/11/05/asia/china-bhutan-border-dst-intl-hnk/index.html
‘The saddest thing I’ve seen in Italy’: Tiny Trevi Fountain stand-in pool draws scorn ,https://edition.cnn.com//2024/11/05/travel/rome-trevi-fountain-stand-in-pool/index.html
Taylor Swift’s brother steps in to help fan getting kicked out of her concert by security,https://edition.cnn.com//2024/11/05/entertainment/taylor-swifts-brother-austin/index.html
Beyoncé pays perfect homage to Pamela Anderson with ‘Beywatch’,https://edition.cnn.com//2024/11/05/entertainment/beyonce-pamela-anderson-costume/index.html
"Voting nationwide has been mostly orderly, despite non-credible bomb threats from Russian origin",https://edition.cnn.com//2024/11/05/politics/voting-security-election-day/index.html
"Rudy Giuliani’s apartment was emptied weeks ago, victims in defamation case say",https://edition.cnn.com//2024/11/05/politics/rudy-giuliani-bankruptcy-freeman-moss/index.html
‘Too much grief and no joy’: This couple plans to return to the US after their dream life in France became a ‘nightmare’ ,https://edition.cnn.com//travel/us-couple-dream-life-france-became-nightmare/index.html
A conservative Christian couple went public about their son’s sexuality. It cost them almost everything ,https://edition.cnn.com//2024/11/03/us/conservative-christian-coming-out-gay-cec/index.html
Leopard and deer run wild at this forest resort ,https://edition.cnn.com//travel/nepal-gokarna-forest-resort-kathmandu-spc/index.html
Trump’s media stock is halted for extremely volatile trading as America goes to the polls ,https://edition.cnn.com//2024/11/05/investing/trump-stock-election-truth-social/index.html
"Nigeria court frees 119 protesters, some facing death penalty, after government drops charges ",https://edition.cnn.com//2024/11/05/africa/nigeria-court-frees-protesters-intl/index.html
New homeowners find skeleton in attic 15 years after previous occupant disappeared ,https://edition.cnn.com//2024/11/05/europe/france-skeleton-attic-scli-intl/index.html
Barry Keoghan hits back at trolls over ‘disgusting’ parenting comments ,https://edition.cnn.com//2024/11/05/entertainment/barry-keoghan-online-trolls-intl-scli/index.html
Mysterious engraved pictographs may have led to the earliest form of writing ,https://edition.cnn.com//2024/11/05/science/origins-of-writing-cuneiform/index.html
"A Las Vegas woman was found strangled to death in 1994. Decades later, a nonprofit group helped identify her killer ",https://edition.cnn.com//2024/11/05/us/cold-murder-cases-vegas-justice-league/index.html
‘A really remarkable smoking gun’: Why scientists think they’re on the verge of finding ‘Planet 9’ ,https://edition.cnn.com//2024/11/04/science/planet-nine-kuiper-belt-latest-evidence/index.html
Soccer player killed by lightning strike during match in Peru ,https://edition.cnn.com//2024/11/04/sport/peru-soccer-lightning-intl-hnk-spt/index.html
7 binge-worthy YouTube series that are worth spending hours watching ,https://edition.cnn.com//2024/11/05/entertainment/binge-worthy-youtube-series/index.html
"Umpire suspended for ‘inappropriate, offensive, and in poor taste’ costume ",https://edition.cnn.com//2024/11/05/sport/leigh-haussen-afl-umpire-suspended-costume-spt-intl/index.html
"Rafael will become a hurricane soon, but the storm and its path toward the US could change drastically ",https://edition.cnn.com//2024/11/05/us/tropical-storm-rafael-forecast-hurricane-hnk/index.html
Jason Kelce apologizes after video shows him spiking a fan’s cellphone ,https://edition.cnn.com//2024/11/04/sport/jason-kelce-apologizes-after-spiking-a-cellphone-after-fan-slur-spt-intl/index.html
LiDAR reveals a long-hidden Maya city with thousands of structures ,https://edition.cnn.com//2024/11/02/science/maya-city-discovered-valeriana-mexico/index.html
How to spot a fireball from the first branch of the Taurid meteor showers,https://edition.cnn.com//2024/11/04/science/meteor-shower-southern-taurids/index.html
Aging spacecraft starts up a radio transmitter it hasn’t used since 1981 from 15 billion miles away,https://edition.cnn.com//2024/11/01/science/voyager-1-transmitter-issue/index.html
The ancient monastery hanging from the side of a cliff ,https://edition.cnn.com//travel/sumela-ancient-monastery-hanging-from-cliff-turkey/index.html
She got on a plane to find the guy she fell for at Oktoberfest. ‘I’m going to go and find my ginger’,https://edition.cnn.com//travel/oktoberfest-munich-airplane-chance-encounters/index.html
‘Horizon’ plane’s innovative shape promises greener flights and added comfort,https://edition.cnn.com//travel/natilus-horizon-blended-wing-aircraft-spc/index.html
"New Yorkers have jaywalked for decades. It’s now legal, but tourists may want to think twice before following locals into the street",https://edition.cnn.com//travel/jaywalking-legalized-new-york-city/index.html
"Boeing workers vote to accept deal, end strike ",https://edition.cnn.com//2024/11/04/business/boeing-strike-vote-hnk-intl/index.html
The world is about to get some much-needed clarity on the US economy’s future,https://edition.cnn.com//2024/11/03/business/us-economy-election-federal-reserve/index.html
"Berkshire’s cash soars to $325 billion as Buffett sells Apple, BofA; operating profit falls",https://edition.cnn.com//2024/11/02/business/berkshire-buffett-sells-apple-bofa/index.html
US rent and home prices are through the roof. Harris and Trump each say they have the answer,https://edition.cnn.com//2024/11/02/economy/housing-affordability-presidential-election/index.html
"Move over diamonds, this eerie-looking ancient gemstone is back in style ",https://edition.cnn.com//2024/09/17/style/jet-black-jewels-gems-whitby/index.html
Why Ibiza is having a moment once again,https://edition.cnn.com//2024/08/09/style/ibiza-arts-fashion/index.html
"Collins Dictionary’s word of the year is a confident, messy way of life",https://edition.cnn.com//2024/11/01/style/brat-word-of-the-year-collins-dictionary-intl-scli/index.html
Hello Kitty at 50: The mouthless face that launched an $80 billion empire,https://edition.cnn.com//2024/10/31/style/hello-kitty-50th-anniversary-japan-hnk-intl/index.html
Chiefs and Lions on Super Bowl collision course? Improvement from Bryce Young? Chargers showing promise? NFL Week 9 takeaways ,https://edition.cnn.com//2024/11/05/sport/nfl-week-9-takeaways-spt-intl/index.html
Australian Rules umpire suspended after dressing up as Osama bin Laden at party,https://edition.cnn.com//2024/11/05/sport/leigh-haussen-afl-umpire-suspended-costume-spt-intl/index.html
Sydney Marathon named as seventh major race in elite circuit,https://edition.cnn.com//2024/11/03/sport/sydney-marathon-australia-seventh-world-major-spt-intl-hnk/index.html
Max Verstappen mounts incredible comeback at Sao Paulo GP to all but clinch F1 championship,https://edition.cnn.com//2024/11/04/sport/sao-paulo-gp-verstappen-f1-spt-intl/index.html
Jill Biden closes out campaign with her own push for Harris ,https://edition.cnn.com//2024/11/03/politics/jill-biden-kamala-harris-campaign-2024/index.html
These 10 states are voting on abortion ballot measures in the 2024 election,https://edition.cnn.com//2024/11/05/politics/abortion-state-ballot-measure-dg/index.html
The 10 Senate seats most likely to flip in 2024,https://edition.cnn.com//2024/11/03/politics/senate-seats-flip-election/index.html
Frustration grows as federal agency struggles to combat election lies spread by Americans,https://edition.cnn.com//2024/11/02/politics/federal-agency-combat-election-lies/index.html
Why you’re more likely to solve your problems on a therapist’s sofa than on social media ,https://edition.cnn.com//2024/11/04/health/social-media-mental-health-misinformation-wellness/index.html
"Life with narcolepsy: ‘It’s not a joke, it’s a very serious illness’",https://edition.cnn.com//2024/11/01/health/narcolepsy-wellness/index.html
"Endocrine-disrupting chemicals are everywhere and could have many health impacts, researchers say",https://edition.cnn.com//2024/10/29/health/endocrine-disrupting-chemicals-wellness/index.html
5 tips to wean yourself off added sugar,https://edition.cnn.com//2024/10/28/health/cutting-added-sugar-recommendations-wellness/index.html
Google and Meta are blocking political ads to combat misinformation. Some experts say it’s too late ,https://edition.cnn.com//2024/11/05/tech/social-media-election-ads-pause-misinformation/index.html
TikTok’s founder is now China’s richest person. But the country’s total number of billionaires has shrunk,https://edition.cnn.com//2024/10/30/tech/tiktok-founder-china-richest-intl-hnk/index.html
"Rafael could become a hurricane soon, but the storm and its path could change drastically as it heads toward the US ",https://edition.cnn.com//2024/11/05/us/tropical-storm-rafael-forecast-hurricane-hnk/index.html
ATMs looted,https://edition.cnn.com//2024/10/27/europe/criminals-atm-robberies-europe-intl/index.html
A new volcanic era,https://edition.cnn.com/https://edition.cnn.com/interactive/2024/10/climate/solutions/iceland-volcanos/
Big Tech CEOs calling up Trump,https://edition.cnn.com//2024/10/27/politics/big-tech-ceos-donald-trump-election/index.html
JD Vance,https://edition.cnn.com//2024/10/27/politics/jd-vance-state-of-the-union/index.html
Unseen photos of William and Diana,https://edition.cnn.com//2024/10/27/uk/prince-william-diana-photos-homelessness-intl/index.html
"9,000-foot ‘death-trap’",https://edition.cnn.com//2024/10/25/sport/tommy-caldwell-alex-honnold-devils-climb-intl-spt/index.html
At least 126 dead and missing in massive flooding and landslides in Philippines ,https://edition.cnn.com//2024/10/26/asia/philippines-flooding-storm-trami-intl-latam/index.html
The planet’s largest lake is shrinking fast. Experts fear it may never recover ,https://edition.cnn.com//2024/10/24/climate/caspian-sea-shrinking-pollution/index.html
Fact Check,https://edition.cnn.com//2024/10/27/politics/fact-check-trump-rogan-podcast/index.html
Vance says Trump’s ‘enemy from within’ comments were directed at dissenting Americans,https://edition.cnn.com//2024/10/27/politics/jd-vance-state-of-the-union/index.html
Britain is skirting the sidelines of the US election,https://edition.cnn.com//2024/10/27/politics/us-uk-starmer-trump-harris-elections-intl/index.html
Never-before-seen photos of Prince William with his mother Diana released ,https://edition.cnn.com//2024/10/27/uk/prince-william-diana-photos-homelessness-intl/index.html
Adele and Celine Dion shed tears in sweet concert encounter,https://edition.cnn.com//2024/10/27/entertainment/adele-celine-dion/index.html
Yamal makes history as Barcelona hammers Real Madrid in El Clásico,https://edition.cnn.com//2024/10/27/sport/lamine-yamal-history-barcelona-real-madrid-el-clasico-spt-intl/index.html
