noticia,link
This teen became the youngest person to summit the world’s highest peaks. Now he wants others to follow in his footsteps,https://edition.cnn.com//2024/10/26/travel/nima-rinji-sherpa-mountaineering-legacy-intl-hnk/index.html
Airline cracks down on ‘gate lice’ who skip the line,https://edition.cnn.com//travel/airline-cracks-down-on-gate-lice/index.html
Criminals are looting millions from ATMs in Europe ,https://edition.cnn.com//2024/10/27/europe/criminals-atm-robberies-europe-intl/index.html
"More US families making over $150,000 are living paycheck to paycheck",https://edition.cnn.com//2024/10/27/economy/wealthy-households-living-paycheck-to-paycheck/index.html
Japan’s ruling party set to lose long-standing majority in blow to new PM,https://edition.cnn.com//2024/10/27/asia/japan-ruling-party-loses-majority-election-intl/index.html
Georgia’s pro-EU opposition cries foul as ruling party claims election victory,https://edition.cnn.com//2024/10/26/europe/georgia-election-uncertain-russia-intl-latam/index.html
Woman who zipped boyfriend in suitcase until he died found guilty of second-degree murder,https://edition.cnn.com//2024/10/26/us/florida-woman-boyfriend-suitcase-guilty-murder/index.html
"He lost a finger and survived a kidnapping. Then, this climber took on a 9,000-foot ‘death-trap’ ",https://edition.cnn.com//2024/10/25/sport/tommy-caldwell-alex-honnold-devils-climb-intl-spt/index.html
Witches walk among us. They’re not like the fictional ones you grew up with ,https://edition.cnn.com//2024/10/26/us/witches-modern-witchcraft-witchtok-cec/index.html
Scientists say skeletal remains found in castle well belong to figure from 800-year-old saga ,https://edition.cnn.com//2024/10/25/science/well-man-bones-norse-saga/index.html
Harris makes final push to close gap with male voters ,https://edition.cnn.com//2024/10/27/politics/harris-campaign-male-voters-sports-ads/index.html
Bus crash in central Mexico kills 19 people ,https://edition.cnn.com//2024/10/26/americas/mexico-bus-crash-intl-latam/index.html
"Big Tech CEOs are calling up Trump, seeking to rekindle their relationship with the former president ahead of Election Day ",https://edition.cnn.com//2024/10/27/politics/big-tech-ceos-donald-trump-election/index.html
The Pope has shown openness to greater roles for women – but there’s pressure for him to go further ,https://edition.cnn.com//2024/10/27/europe/pope-women-roles-vatican-church-intl/index.html
Archaeologists uncover tiny house in Pompeii with intact elaborate frescoes ,https://edition.cnn.com//2024/10/25/style/tiny-house-frescoes-pompeii-intl-scli/index.html
Iceland embraced a shorter work week. Here’s how it turned out ,https://edition.cnn.com//2024/10/25/business/iceland-shorter-working-week-economy/index.html
An engineer in Florida is searching for the owner of a ring discovered in hurricane wreckage ,https://edition.cnn.com//2024/10/26/us/ring-found-florida-hurricane-debris/index.html
Lizzo’s Halloween costume draws inspiration from infamous ‘South Park’ episode ,https://edition.cnn.com//2024/10/26/entertainment/lizzo-south-park-ozempic-halloween-costume/index.html
Groundbreaking telescope reveals first piece of new cosmic map ,https://edition.cnn.com//2024/10/26/science/euclid-vera-rubin-telescope-science-newsletter-wt/index.html
Dodgers star Shohei Ohtani suffers apparent shoulder injury during Game 2 of the World Series ,https://edition.cnn.com//2024/10/26/sport/la-dodgers-shohei-ohtani-world-series-injury/index.html
She connected on Instagram with a guy who lived in another country. Then they decided to meet up ,https://edition.cnn.com//travel/instagram-stranger-india-romance-chance-encounters/index.html
For subscribers: Most space travelers face the same debilitating ailment. The experience of 4 civilian astronauts could offer answers ,https://edition.cnn.com//2024/10/25/science/spacex-polaris-dawn-astronaut-health/index.html
A SpaceX capsule just came back to Earth. Here’s why Boeing Starliner’s astronauts weren’t on it,https://edition.cnn.com//2024/10/24/science/boeing-astronauts-spacex-crew-8-splashdown/index.html
Stunning fossil trapped in amber reveals previously unknown species that lived during the time of dinosaurs,https://edition.cnn.com//2024/10/24/science/firefly-fossil-mesozoic-bioluminescence-evolution/index.html
Lost Silk Road cities mapped using remote sensing,https://edition.cnn.com//2024/10/23/science/lost-silk-road-cities-laser-mapping/index.html
Europe’s secret season for travel starts now ,https://edition.cnn.com//travel/europe-shoulder-season-travel-savings/index.html
He served with the US Army in Iraq. Now he’s a 3-star Michelin chef,https://edition.cnn.com//travel/culinary-class-wars-netflix-judge-chef-sung-anh-mosu-intl-hnk/index.html
How the full English breakfast divides Britain,https://edition.cnn.com//travel/full-english-breakfast-britain/index.html
"Tired of California, he moved to Colombia: ‘I feel safer here’",https://edition.cnn.com//travel/swapped-united-states-san-francisco-medellin-colombia/index.html
The magical white stone wonderland with effervescent bathing pools,https://edition.cnn.com//travel/pammukale-hierapolis-turkey-white-pools/index.html
What the rising popularity of Yemeni coffee shops says about third places ,https://edition.cnn.com//2024/10/26/business/yemeni-coffee-shops-us-popularity/index.html
Jury awards Apple $250 in design patent lawsuit against Masimo,https://edition.cnn.com//2024/10/25/business/apple-masimo-patent-lawsuit/index.html
"Why Nike, Starbucks and Boeing have lost their magic",https://edition.cnn.com//2024/10/25/business/starbucks-nike-boeing-nightcap/index.html
Amazon Prime wants to help you save on gas,https://edition.cnn.com//2024/10/24/business/amazon-prime-wants-to-help-you-save-on-gas/index.html
US businesses are suffering from election uncertainty — and it could be hurting the economy,https://edition.cnn.com//2024/10/24/economy/election-uncertainty-hurting-us-economy/index.html
Keurig Dr Pepper will buy energy drink maker Ghost for more than $1 billion,https://edition.cnn.com//2024/10/24/business/ghost-energy-drink-keurig-dr-pepper/index.html
"These are 2024’s top trending Halloween costumes, according to Google ",https://edition.cnn.com//2024/10/24/style/halloween-costumes-google-trends-2024/index.html
Zendaya pays tribute to Cher in shimmering vintage gown,https://edition.cnn.com//2024/10/21/style/zendaya-cher-tribute-lotw/index.html
"Painting by AI robot Ai-Da could fetch more than $120,000 at auction",https://edition.cnn.com//2024/10/24/style/ai-da-ai-robot-painting-auction-sothebys-intl-scli-tan/index.html
Striking photos document environmental decay on world’s largest lake,https://edition.cnn.com//2024/10/18/style/khashayar-javanmardi-caspian-photography/index.html
"The painter whose erotic, glamorous portraits made her a belated art icon",https://edition.cnn.com//2024/10/23/style/tamara-lempicka-painting-art-deco-exhibit/index.html
"Super-thin skyscraper, just one apartment wide, planned for Dubai",https://edition.cnn.com//2024/10/22/style/super-thin-skyscraper-dubai-scli-intl/index.html
"Meet Rojé Stona, an Olympic track and field champion with dreams of playing in the NFL ",https://edition.cnn.com//2024/10/26/sport/roje-stona-nfl-discus-throw-olympics-spt-intl/index.html
Can New York Yankees recover from last-gasp World Series Game 1 loss against Los Angeles Dodgers in Game 2?,https://edition.cnn.com//2024/10/26/sport/yankees-dodgers-game-2-world-series-spt-intl/index.html
Inter Miami beats Atlanta United in Lionel Messi’s MLS playoff debut,https://edition.cnn.com//2024/10/26/sport/inter-miami-atlanta-united-mls-playoff-lionel-messi-spt-intl/index.html
Los Angeles Dodgers’ Freddie Freeman launches himself into history with dramatic grand slam to win Game 1 of the World Series,https://edition.cnn.com//2024/10/25/sport/yankees-dodgers-world-series-game-1-spt-intl/index.html
Miami Dolphins quarterback Tua Tagovailoa cleared to return and will play Sunday against Arizona Cardinals,https://edition.cnn.com//2024/10/25/sport/tua-tagovailoa-clears-concussion-protocol-spt-intl/index.html
USF men’s head basketball coach Amir Abdur-Rahim dead at 43,https://edition.cnn.com//2024/10/24/sport/usf-basketball-amir-abdur-rahim-spt-intl/index.html
"For Trump, today’s MSG rally signifies more than just a campaign stop ",https://edition.cnn.com//2024/10/27/politics/trump-madison-square-garden-rally/index.html
Trump says he’s open to eliminating income taxes as he pushes sweeping tariff proposals on Joe Rogan’s podcast,https://edition.cnn.com//2024/10/26/politics/trump-joe-rogan-podcast-income-tax-tariffs/index.html
US intelligence assesses Russian operatives behind fake video showing Pennsylvania ballots being destroyed,https://edition.cnn.com//2024/10/25/politics/us-intelligence-assesses-russians-behind-fake-video-pennsylvania-ballots/index.html
"NY Republican in critical House race spent huge sums of campaign cash on steakhouses, booze, Ubers and a foreign hostel",https://edition.cnn.com//2024/10/25/politics/ny-republican-anthony-desposito-campaign-spending/index.html
More straight couples are calling each other partner. Here’s why ,https://edition.cnn.com//2024/10/24/health/partner-boyfriend-girlfriend-labels-wellness/index.html
"How long can you stand like a flamingo? The answer may reflect your age, new study says",https://edition.cnn.com//2024/10/23/health/balance-one-leg-old-age-wellness/index.html
What experts say about taking psilocybin as an alternative treatment for depression,https://edition.cnn.com//2024/10/22/health/psilocybin-versus-antidepressant-wellness/index.html
5 ways to support your friends with cancer,https://edition.cnn.com//2024/10/21/health/breast-cancer-support-help-wellness/index.html
Does your teen consume protein supplements? Here’s what experts say,https://edition.cnn.com//2024/10/21/health/protein-supplement-teens-poll-wellness/index.html
X changed its terms of service to let its AI train on everyone’s posts. Now users are up in arms ,https://edition.cnn.com//2024/10/21/tech/x-twitter-terms-of-service/index.html
Elon Musk says he’ll fix the government under Trump. His track record paints a different picture,https://edition.cnn.com//2024/10/22/tech/elon-musk-government-efficiency/index.html
Meta fires employees for spending food allowances on personal items like acne pads and wine glasses,https://edition.cnn.com//2024/10/17/tech/meta-employees-fired-meal-credits-layoffs/index.html
Swiping right ahead of the election: Popular dating apps have new features to show off political views,https://edition.cnn.com//2024/10/17/tech/dating-apps-politics-election/index.html
Commonwealth leaders say ‘time has come’ for discussion on UK slavery reparations ,https://edition.cnn.com//2024/10/26/world/commonwealth-leaders-slavery-reparations-intl/index.html
‘That fight to survive’: Dock tragedy is latest chapter in Gullah Geechee community’s long struggle,https://edition.cnn.com//2024/10/27/us/georgia-dock-collapse-gullah-geechee-community/index.html
"The rape claims that tie the Menendez case to Menudo: ‘There might be other victims,’ doc producer says",https://edition.cnn.com//2024/10/25/entertainment/menendez-brothers-menudo/index.html
"Military investigation into incident during Trump’s controversial Arlington Cemetery still ongoing, Army report says",https://edition.cnn.com//2024/10/25/politics/arlington-cemetery-incident-trump-visit-investigation/index.html
"Two $140,000 tickets for 12-minute space trip sell immediately",https://edition.cnn.com//2024/10/25/china/china-space-tourism-ticket-sale-livestream-intl-hnk/index.html
Kate Bush is ‘very keen’ to make a new album,https://edition.cnn.com//2024/10/25/entertainment/kate-bush-new-music-gbr-scli-intl/index.html
"Hillary Clinton says Trump is ‘more unhinged, more unstable’ than in 2016",https://edition.cnn.com//2024/10/25/politics/hillary-clinton-trump-harris-election/index.html
Former CEO of WWE sued for allegedly enabling sexual abuse,https://edition.cnn.com//2024/10/24/business/vince-mcmahon-wwe-lawsuit-prevented-sexual-assault/index.html
Nicole Scherzinger ‘will forever cherish and treasure the time’ with Liam Payne,https://edition.cnn.com//2024/10/25/entertainment/nicole-scherzinger-liam-payne-tribute/index.html
World’s best bars for 2024,https://edition.cnn.com//travel/worlds-best-bar-awards-2024-handshake-speakeasy-mexico-city/index.html
