Producto,Precio,Estrellas,Link,Reseñas
Xbox Series X – 1TB Digital Edition,US$448.00,3.8,https://www.amazon.com/-/es/Xbox-X-1TB-Digital/dp/B0DCD9LGHY/ref=sr_1_1?__mk_es_US=%C3%85M%C3%85%C5%BD%C3%95%C3%91&dib=eyJ2IjoiMSJ9.BhhlnlbXGtfp-fhLm1erHoKq6hoJBfMMmlPW2VhISqZoTcLyK1oRJshCX2CZIBBM5fJnWyfYy83GSnhSAIccSJcV8KMybl7_qGWAMh3SfegtcpdcFzzleGlgCS0GXLAR8jwN8UtnryW05r1RD6CBpcoaamwYL0U81Kg6fbdeiT8VG9JSKEJSUczcNb67Ywq7Kbi6GKkAiCZzUf2BRHbrtxHhPYCX1C_oc9JFzYqoe-8.kElLdiPKyAqPYCv3-RTVC7peNMAnjk6wpDx6k-SaPYk&dib_tag=se&keywords=xbox&qid=1731040840&sr=8-1,"The best Xbox ever///I’ve had Xboxes since the first generation, and this is the best so far.  Paired with a 4k 120hz tv, this thing rules.  Download is somewhat slow with WiFi, but connect to a Ethernet cable and it’s fine.  I don’t play a huge amount of games, so the built in storage is fine for me.  It’s just a great platform.///Long Installation & Download///Bought as a Birthday present and thought we can play a little after the dinner party. One hour in installation - does not seem getting closer. Joystick is nice, but not designed to type multiple passwords on the screen for sure. Then downloading the game takes another hour. Just abandoned the effort.Also in the digital edition the games are super expensive $60-$100 per game, while you can buy cds for $25.///Very good Xbox///Very nice good one///tanto server same as ps5///save your money same as ps5  same server TANTO real bad not any better and you gotta start at 0 points some games are ok but most no good not good for COD///Super Fast Delivery///The New Series X Digital looks so good in Robot white. Gaming is what you'd expect. AMAZING!"
Xbox Series S Console - White 1TB,US$348.00,3.6,https://www.amazon.com/-/es/Xbox-S-Console-White-1TB/dp/B0D934SHFG/ref=sr_1_2?__mk_es_US=%C3%85M%C3%85%C5%BD%C3%95%C3%91&dib=eyJ2IjoiMSJ9.BhhlnlbXGtfp-fhLm1erHoKq6hoJBfMMmlPW2VhISqZoTcLyK1oRJshCX2CZIBBM5fJnWyfYy83GSnhSAIccSJcV8KMybl7_qGWAMh3SfegtcpdcFzzleGlgCS0GXLAR8jwN8UtnryW05r1RD6CBpcoaamwYL0U81Kg6fbdeiT8VG9JSKEJSUczcNb67Ywq7Kbi6GKkAiCZzUf2BRHbrtxHhPYCX1C_oc9JFzYqoe-8.kElLdiPKyAqPYCv3-RTVC7peNMAnjk6wpDx6k-SaPYk&dib_tag=se&keywords=xbox&qid=1731040840&sr=8-2,"Make the jump!///I was skeptical about switching to next gen, especially when I have ULTIMATE and can use cloud gaming. BROOOOOOOOOOO, let me say this: DO IT.Faster load times... LIKE SIGNIFICANTLYGames are beautiful... take a game like Fortnite, that's pretty basic... mannnn, Fortnite is lowkey a beautiful game on next-gen.Smooth, like butter graphics. I played The Division 2 last night and I felt like John Wick.The only thing was waiting for the first game to download. It was like an 80GB one.If you've got ULTIMATE, there's NO REASON to not buy a next gen console, the money you save on games, grab the upgrade. 4k (although not true 4k, but who's counting pixels) is amazing. My eyes actually need to adjust to the clarity. Lol.///Forced to install updates you don’t want///This console was a brick the day it was released. As usual, Microsoft is years behind its competitors. I don’t even know why I was stupid enough to purchase one. The biggest issue is that in order to play games you purchased, you must constantly update them. That’s ridiculous. Why? It was working just fine. The other issue is that it continues to take up more and more space. I regret few things in life, but purchasing this junk has to be on the top. Save yourself some headache and buy a different system.///Great gaming system///Fast gaming system really like it. You can play a lot of games on here///Great///Arrived on time and works great.///cadeau arrivé à l'avance///arrivé  sans délai...et c'est un des premiers que je trouvais qui se vendait pas trop cher avec la manette et le câble inclus , ne reste qu'à l'essayer !"
Xbox Series X Console (Renewed),US$449.99,4.1,https://www.amazon.com/-/es/Xbox-X-Console-Renewed/dp/B0CJ3XWXP8/ref=sr_1_3?__mk_es_US=%C3%85M%C3%85%C5%BD%C3%95%C3%91&dib=eyJ2IjoiMSJ9.BhhlnlbXGtfp-fhLm1erHoKq6hoJBfMMmlPW2VhISqZoTcLyK1oRJshCX2CZIBBM5fJnWyfYy83GSnhSAIccSJcV8KMybl7_qGWAMh3SfegtcpdcFzzleGlgCS0GXLAR8jwN8UtnryW05r1RD6CBpcoaamwYL0U81Kg6fbdeiT8VG9JSKEJSUczcNb67Ywq7Kbi6GKkAiCZzUf2BRHbrtxHhPYCX1C_oc9JFzYqoe-8.kElLdiPKyAqPYCv3-RTVC7peNMAnjk6wpDx6k-SaPYk&dib_tag=se&keywords=xbox&qid=1731040840&sr=8-3,"Quality console///Works like new. Not a single scratch or scuff, very happy. Loved the no hassle financing, would love to see the same type no credit check financing. Would be awesome to have this option on more big ticket items.///Great quality for a Refurbished/Renewed Console///I will update if this changes on anyway.Got to be honest, I thought for a moment I was getting a brand new never before used console. Packaging was great, all smelled new and it was neat and flawless. The only way to know you have a Refurbished/Renewed console is by reading about it on the box on a corner with not so big letters that says ""Refurbished""Device is accompanied by a new controller and both HDMI and Power Cord (which all seemed new).At my house my kids and I have been using it for an average of 6 hours daily and so far it is working great. I am now considering getting a fan to maintain device temperature even lower (and extend life).Just in case, get the assurion extended warranty, as I did. You never know how will time affect the refurbished unit and, at around $49 for 3 years of worry free use? No brainer. (PS. it just has 90day warranty out of the box. Prime Day deal had this unit at 369+tax. There are some other Used ""Like New"" Xbox's from Amazon that brings a whole year warranty.)///Broke down  in 3 days///I ordered this refurbished Series X during Prime days. It is the same Microsoft refurbished Series X you get on the official Xbox website. I didn’t know that until I received the package which is a sealed Microsoft Series X refurbished package.Aesthetically everything was in very very good conditions. The controller looked brand new.It worked fine for about 3 days then it shutdown during a game session and refused to restart. I tried unplugging it, pressing the power button for 30 secs, change outlet … nothing. The console would turn on for a sec and immediately shutdown again.It appears it’s a known power supply issue if Reddit is to be believed, pretty common on earlier units. The one I received had a service date sticker of Mar 2022 if it makes any difference and I would hope they’d have fixed it.Anyway I returned it less than 4 days since delivery, I wouldn’t mind trying a second one just in case I was unlucky but without the extra Prime Days discount it’s just not interesting to me and there was no option for a replacement just for a refund.My experience with this has been bad, a refurbished console should be able to work for more than 3  days of light use, I doubt I had more than 1 hour of play a day out of it aside initial setup.This was sold and shipped by Amazon so not sure who’s to blame … this refurbished business seems to be very hit or miss (bought an Amazon Premium Renewed OLED Switch months ago and that has had no issues but a refurbished One X from 3rd party would overheat in minutes and now this refurbished Series X breaking down so soon …. very very frustrating and disappointing)///Me and my friend bought two Xbox’s///Me and my friend bought 2 Xbox’s and we’ve had them for 3 months now and it’s been great I’ve had no issues at all and I saved a lot of money I would highly recommend it they both run like new///Xbox X series///This xbox is like a brand new xbox I've had no issues at all for it to have been renewed or refinished or whatever.  I am very pleasantly surprised. Iwanted to give a review once I've used it for more than 30 days.///Quality product///The past reviews had me a little worried about buying a refurbished Xbox. But when it arrived, it looked flawless and started right up, no problems. Been playing on it for a few hours now and it’s been fine, absolutely no issues. Will update if I run into any problems.///honest human review///Shipment was delayed supposed to come in on sunday came on Thursday. Did come in thought UPS not amazon. At first of putting in power cord and HDMI cord ( HDMI cord did work) it would not turn on, but after inserting and plugging the power cord of the xbox off and on several times it did eventually work and then turned on. When it turned on it did restart itself twice but after worked completely normal. After all that no issues came from the xbox. Games like college football and Jedi Survivor has worked smoothly and download speed runs fast. Actually would recommend especially during prime day. A Xbox S 1TB was 350 no shipping while this on prime day in 2024 was 400 with shipping so definitely worth but can be risky with all the other reviews in place. Risk it though because this is way more worth it.///Nice!///Was a little worried about buying a renewed xbox on amazon but this thing came in perfect condition and looked like it had never been used before. would 100% buy again///Great Christmas gift for my son!///This Xbox Series X Console was a renewed edition, you can't even tell the difference. It looks brand new just like a new console and everything works great. It has 1TB storage and the games all downloaded pretty quick. My son was very happy and excited to receive this this Xbox series X console, it was a surprise for him and an early Christmas Gift from Me. It was shipped in 2 business days and arrived at my doorstep 2 days after it was ordered. Now that is what you call fast shipping. It was a good investment for my son and he loved it! Thank you To The Seller!///Good renewed///It's working great, loving it. Just hate that I bought a Sealan monitor that had false advertising to go with it. It's 1080p and my Xbox is 8k. They lied.///Stopped working!!! Don't waste ur money!!!///My daughter saved up all year to purchase this! Played for a month. Started having the issue of not turning on a couple weeks in but thought maybe it was the controller. The console won't start now. No matter what we're tried. I wish she had spent money on the warranty.  She's so down about losing so much money on what should be considered garbage! Don't waste ur money on the Xbox X console!!!!///Xbox Series X: A Budget-Friendly Beast of a Console!///After spending some time with the Xbox Series X, I’m really impressed with what it brings to the table. This console definitely lives up to the hype as a powerhouse. From the moment I started using it, the performance was top notch. Games run smoothly in 4K, and it stays impressively quiet (I have a PS5 for comparison) even during intense gaming sessions.One thing that really stood out to me is how well it handles heat. Even in the middle of a recent heatwave, the Xbox Series X stayed cool and didn’t overheat, which is a huge plus. The build quality feels solid it’s sturdy and durable, which gives me confidence that it’ll last a long time.The controller is another highlight. It feels incredibly rugged and well-built, almost like it could take a beating and still keep going. Overall, the Xbox Series X has surpassed my expectations in terms of power and build quality. It’s a fantastic choice for anyone looking for a high-end gaming experience without breaking the bank lol. The only downside is the limited number of exclusive titles, but other than that, it’s pretty much perfect. 😄 👍///Awesome///Play a lot of games. Always works great. A little difficult to get going like registration issues. Had to get the neighbors kid to set it up. Once it was working it was great. Of coarse it was pricy but in the long run well worth the money. Zero issues with it over one year now."
Xbox Series S Starter Bundle - Includes hundreds of games with Game Pass Ultimate 3 Month Membership - 512GB SSD All-Digital Gaming Console,US$369.00,4.7,https://www.amazon.com/-/es/Xbox-Starter-Bundle-hundreds-Membership-All-Digital/dp/B0CFS1SDC4/ref=sr_1_4?__mk_es_US=%C3%85M%C3%85%C5%BD%C3%95%C3%91&dib=eyJ2IjoiMSJ9.BhhlnlbXGtfp-fhLm1erHoKq6hoJBfMMmlPW2VhISqZoTcLyK1oRJshCX2CZIBBM5fJnWyfYy83GSnhSAIccSJcV8KMybl7_qGWAMh3SfegtcpdcFzzleGlgCS0GXLAR8jwN8UtnryW05r1RD6CBpcoaamwYL0U81Kg6fbdeiT8VG9JSKEJSUczcNb67Ywq7Kbi6GKkAiCZzUf2BRHbrtxHhPYCX1C_oc9JFzYqoe-8.kElLdiPKyAqPYCv3-RTVC7peNMAnjk6wpDx6k-SaPYk&dib_tag=se&keywords=xbox&qid=1731040840&sr=8-4,"Amazon’s!!!///Great for all gamers especially for xboxerrrs!!! This console had great gaming quality and more storage space///This Xbox is amazing.///Omg it works great, fast delivery and well packed. And the price of this Xbox series s was well worth the money. Thank you so very much I am absolutely loving it.///Very incredible///I like the xbox and it comedy with free game pass///Good deal///I mean it’s the Xbox series S.Overall good deal considering the extras!///Works great but game pass doesn’t work///The Xbox came early!! I had no problems setting it up. I haven’t had an Xbox in a couple of years so it did take me a little to relearn how the controller works. I love ittt!!! Only issue is when I try to claim the game pass it says there’s an issue. Ive been trying to figure out the problem for a couple of days but still can’t manage to figure out the problem. Which sucks because that’s one of the main things I was looking forward to. Hopefully I can figure it out soon.///Worth the money///This was a gift for my son who had to upgrade stuff in order to continue to play games.///Giving Credit Where it's Due///Now granted, I don't have a smart 4k state of the art tv, but for the price I got for the brand, I'm satisfied with how games looked on it. This was before playing on the Series S. The games, streaming services, even YouTube looks amazing through the system. Yes, it would be nice to have a Series X for the disc. But I'm really impressed with this little console that could. Not only does it run amazing, the quick resume feature blows my mind everytime I switch from YouTube to a game. I think I'm more impressed with just how quiet this thing is. My former main console was a PS4 Pro. And oh boy, it was like a plane was taking off everytime it need to load. If you have the money for a Series X, I'd say go for it; especially if you can find a sale going for it. But if you don't care for the disc drive or the extra power, you won't be disappointed with the Series S. With this and Game Pass, I'm set for life!///Came early///As i said it arrived early it had a bit on damage on the corners of the box but the console and contents were perfectly fine i love it i boight it because i needed to upgrade from my ps4 and the ps5 is far more expensive but ive loved the xbox exclusives so far its a great console minus its server crashing issues///Great machine///The product was exactly as described. It’s also the fastest loading console I’ve ever owned. I’m very happy with the product and would recommend it to anyone who is looking for a new console. The only downfall is the amount of space the hard drive has. I was only able to install 2 games on it as they were fairly large games but still being a digital machine it should come with more space. I hope this helps anyone that’s contemplating on a new console…///Works great///Great starter set///🔥🔥🔥///The graphics are crazy. The only bad thing is the storage. I returned this and bought the series x since it and more storage and because I was getting it for $560 including tax on sale lmao."
"Xbox One S 1TB Console (Renewed), White",US$199.00,3.9,https://www.amazon.com/-/es/Xbox-One-1TB-Console-Renewed-White/dp/B06WVH7PLL/ref=sr_1_6?__mk_es_US=%C3%85M%C3%85%C5%BD%C3%95%C3%91&dib=eyJ2IjoiMSJ9.BhhlnlbXGtfp-fhLm1erHoKq6hoJBfMMmlPW2VhISqZoTcLyK1oRJshCX2CZIBBM5fJnWyfYy83GSnhSAIccSJcV8KMybl7_qGWAMh3SfegtcpdcFzzleGlgCS0GXLAR8jwN8UtnryW05r1RD6CBpcoaamwYL0U81Kg6fbdeiT8VG9JSKEJSUczcNb67Ywq7Kbi6GKkAiCZzUf2BRHbrtxHhPYCX1C_oc9JFzYqoe-8.kElLdiPKyAqPYCv3-RTVC7peNMAnjk6wpDx6k-SaPYk&dib_tag=se&keywords=xbox&qid=1731040840&sr=8-6,"Great product///Works great and looks great///Twas very good///It runs as good as my old xbox did///Excellent condition? LIES.///This was listed as excellent condition. Came with plenty of scratches, works fine. Remote is black not white, and pretty beat. Remote has scratches and the d-pad either won't work or sticks and jumps 3 spaces. The bumpers only work if you put your back into it. Thoroughly disappointed in this purchase. But hey, I got an xbox fairly cheap I guess.///Remote doesn't work///The xbox works great so far, but the remote does not work.///Xbox & controller in good working order///Xbox functions flawlessly. Blu-ray player works perfectly. Controller is official Xbox Microsoft and works well. Appearance of all equipment and cords as barely used. Ran 6 hours straight setting up games and apps and all functionality is excellent.I’m typically very cautious of buying used electronics but in this scenario all is smooth sailing and precisely matched sellers description. Plus worst case scenario Amazon would return it if it didn’t work.///GOOD AS NEW///ORDER THIS XBOX RENEWED CAME JUST HOW IT WAS SUPPOSED TO.///Happy Grandson///Easy set up.///Not a 1t series s beware///Everything you could imagine. That could go wrong did with this. To start it was supposed to be a 1t series s. It's not. It's not it's an Xbox one. Also when booted up it wasn't in English. Two the controller was broken"
Xbox Series S – Fortnite & Rocket League Bundle,US$394.00,4.7,https://www.amazon.com/-/es/Xbox-S-Fortnite-Rocket-League-Bundle/dp/B09H73LTM6/ref=sr_1_7?__mk_es_US=%C3%85M%C3%85%C5%BD%C3%95%C3%91&dib=eyJ2IjoiMSJ9.BhhlnlbXGtfp-fhLm1erHoKq6hoJBfMMmlPW2VhISqZoTcLyK1oRJshCX2CZIBBM5fJnWyfYy83GSnhSAIccSJcV8KMybl7_qGWAMh3SfegtcpdcFzzleGlgCS0GXLAR8jwN8UtnryW05r1RD6CBpcoaamwYL0U81Kg6fbdeiT8VG9JSKEJSUczcNb67Ywq7Kbi6GKkAiCZzUf2BRHbrtxHhPYCX1C_oc9JFzYqoe-8.kElLdiPKyAqPYCv3-RTVC7peNMAnjk6wpDx6k-SaPYk&dib_tag=se&keywords=xbox&qid=1731040840&sr=8-7,"Awesome counsel Great price.///Only place that had it in stock for me can in very handy love Amazon ❤️.///Son loves it! Parental controls are frustrating..///Just what we expected. We tried to use the parental controls for Xbox.. very frustrating.. especially if you have epic accounts already set up.. since Microsoft owns them now.. have to set up Microsoft account for different users.. only set it up for one user…. But the machine works great.///Great price///Great price. Son wnated for his gaming in addition to his computer and this was a great price///Perfect Condition - Bought ""Used-Acceptable"" from Amazon Warehouse///It came in the original box which was a little mangled and taped, but the console and controller were flawless. No issues and I am so happy to have saved more than $50. I bought for myself so the box condition wasn't an issue. The codes for Fortnite and Rocket League were unused. The games load so fast now! Happy with my purchase!Please Note: I brought over my external 2 TB hard drive I was using on my Xbox One S for storage. I have found that the newer Xbox Series X-S games will not install on the external hard drive due to the connection speed between the USB attached hard drive is not fast enough (the Xbox will flash a notification that you won't be able to play the game). With the Series S only having 512 GB of internal storage, I have already run out of space on my internal storage as I play mainly Grand Theft Auto V, Fallout 76, and Conan Exiles. So I will have to buy the Seagate Storage Expansion Card which will be another $150 plus.  This is not a deal breaker, but I wanted to share.///Excellent console but series s n x arent worth upgrade from xbox one x///Honestly, i think the Series S is a superb/great console.Only two cons, cost of external plug-in drive to overcome seriously ludicrous limited memory capacity (no excuse for not having 1TB in S and 2TB in X in modern day) AND its gameplay  speed (Series S n Series X) is really not THAT much better than xbox one x.Aside from faster load times, I really dont see a major difference in performance in series s and an ssd equipped one x. Xbox series x is also not all that without 4k tv n, even with the fancy new tv, its really not that super-impressive. If i had it to do over again, aside from the series x as a surprise gift, i’d have been happy with the Series S and 1tb plug-in drive. Seagate, i think?BUT, aside from moderately faster load times, without games written specifically for these 2 new console iterations, just put an ssd in your xbox one x and keep running it until you HAVE to change up. Maybe the plug in ssd will be more affordable then and id say do that with a series s n enjoy it.To do it again? Id just keep jamming w my one x with high speed ssd. Unfortunately, im prolly giving mine to one of my Destiny clanmates who seriously needs a new console. He sherpas lfg alot of people (looking for game) through raids (like me n i super suck) so its a good cause.I'm on an xbox series x which i got from my sister as a surprise gift. Between series S and X? I’d go with Series S and 1tb expansion card n give my one x to my clanmate. Save the stress n cash n skip the Series X. Use that cash to get a 20th Anniversary or Series 2 Elite Controller to go with your new sweet Series S. Or, put it towards the memory expansion card.Since I've played all 3 n switched back n forth over the last month, i thought I’d share my wisdom. Good luck with your decision n remember, as always, ymmv.///Good!///Other than the little booklet being ripped everything is brilliant, considering i ordered it from the uk and got it in under a week. Dark skully was on there so definitely not a scam. I did notice the box was roughed up but i don't mind as I'm not a collector. I do hope I don't have to come back in some months to say the xbox has died as i have noticed some people saying it breaks down weeks to months later. But so far it's turned on and worked well.///Not the one i wanted but it came brand new///I originally ordered the “midnight drive” drive pack but ended up getting the wrong bundle but everything works and i got everything so i cant complain///It’s an Xbox///Received fairly quick , can’t say much it’s an Xbox.  It works and I’m happy . Go get you one from Amazon///Xbox series S///I'm actually blown away by this, I'd switched over to PlayStation with the last generation but the Xbox series S is the absolute best performance you can get for its price it's super fast and not stupid expensive. Only downside is the hard drive has about 360gb of usable storage the rest is reserved for the OS, backwards compatibility and the quick resume. It boosts a lot of 360 games that was enough for me and I got so much more///Was 100% sceptical///Okay, I was beyond skeptics because this was at least 200$ cheaper than wal-mart, Best Buy, game stop and other electronic sellers. But after reading reviews I took a chance and ordered. Well!! I’m not disappointed in the slightest!! Not only is this a legitimate Xbox series S, it works amazing! And delivery was ridiculously FAST!! Thank heavens for Amazon partnering with Microsoft, saved a ton of money!! If you’re skeptics, don’t be! Make that purchase and save some money for a super cute controller or headset!DO IT!///Best///Best brand of game console. Xbox is #1"
