Producto,Precio,Estrellas,Link,Reseñas
"Logitech G Cloud Handheld Portable Gaming Console with Long-Battery Life, 1080P 7-Inch Touchscreen, Lightweight Design, Xbox Cloud Gaming, NVIDIA GeForce NOW, Google Play",US$296.39,4.3,https://www.amazon.com/-/es/Logitech-Handheld-Long-Battery-Touchscreen-Lightweight-Tablet/dp/B09T9FHZLH/ref=sr_1_39?__mk_es_US=%C3%85M%C3%85%C5%BD%C3%95%C3%91&dib=eyJ2IjoiMSJ9.xkm0kH5DkRAHwvFY7ZBCe3Pu4Qobte2p4nQVdb93cw1Mdmwjjo1Sh52pG0VitNm8leA_PVvlIwvKDQ4qiY10mv5YuXwBMW6KfasfZyEMMM2QCAliiveN9CrHXbEZHMNTP1kjmF2IdCYbEMgWWxbYBplmcBYWSJEXEMsKIlhDC0-9yKj-eMXkZZ_WLXNjyzdGYOsEswvr1ilqoB5dw5ny9rmAicqF-g6c0MyeAp3nUXk.0WkInoihowCI06tmQsEhzU6T-ej_AXmBS6Yu747KX4w&dib_tag=se&keywords=xbox&qid=1731040845&sr=8-39,"The truth about the G Cloud and my experience with PS4 and Xbox Series X play///I received a G Cloud for Christmas in 2023, so I have had a concentrated week of seeing what the device can and cannot do.  Side-note (not factored into the score), the BRAND NEW unit sold by Amazon (not a 3rd party) turned out to be used.  The box seal had been opened, and even the screen protector was gone.  So I returned it and got another.  Second side-note, the first unit came with the wall charger, but the replacement did not (even though it is pictured in the manual).  I thought this was a mistake, but then found a slapped-on statement from Logitech saying they stopped including wall adapters for the good of the environment (yeah that gets a huge LOL, congrats on your cost-savings Logitech).  On to the real review ...I wanted the unit mostly to be able to stream games from my PS4 (in my living room) and Xbox Series X (upstairs in a racing / flying cab).  And long story short - this unit FINALLY delivers what I have been striving for since I tried using the PSP to connect to my PS3 many years ago (and then Vita, which was equally bad at streaming).  The Xbox streaming works great with the Xbox app.  The controllers work amazingly well.  The PS4 at first worked good enough to play, but the resolution varied and sometimes would get a little blocky.  I connected it to my router using a network cable, and that made the streaming become crystal clear.  Works great anywhere in my house.  To stream anywhere in the world requires port forwarding to be setup on the router, and so I am not going to pursue that.  Note that I am using a 3rd party app for the PS4 streaming so the Logitech controls are fully supported.  I will say I can detect a slight lag in the controls (probably less than a tenth of a second), which for a high-speed game (think racing) the experience is still playable but is slightly impacted.  But for my usage (Fallout 4 on PS4, Flight Simulator on Xbox) gameplay feels just fine and a very slight delay does not impact gaming.I am also using the unit as a retro-gaming handheld.  Gaming is fantastic for all consoles that are GameCube and earlier.  PS2 works great for some titles, but has some slowdown for others (but settings can be tweaked to be playable for just about anything).  For me, having a giant library of Advance titles, SNES, Genesis, and yeah even Atari is awesome.The ergonomics of the G Cloud is fantastic.  I have fairly large hands, and it is comfortable to play.  The screen at 7 inches doesn't sound big, but compared to my Switch Lite and older PS handhelds, the screen is a magical giant gift from the gods.  Resolution is a very sharp 1080P.  Touch works great, and so the hardware is quite impressive.  Battery life is outstanding.So the memory at 64GB is one weak point of the system.  There IS a microSD expansion, and I had to spend a couple of days to get everything working well.  Bottom line, I first tried a 512GB Sandisk card, and it did not work correctly, despite trying every formatting method out there.  Folks, 256GB is the max, trust me.  So a Sandisk 256GB works like a charm.  It will NOT work correctly if you extend the storage as part of the Android device.  It has to be formatted as external storage, and then it works great.The beauty of this device is that it is truly just an Android device with Google Play.  So the gaming options are almost unlimited.  And you can use it to watch movies, or control your thermostats, or whatever you use a normal Android device for.In summary, this is an amazing device and I could not be happier with it!///Perfect for what it is designed to do.. stream games from your local consoles.///All these reviews about this device being underpowered for emulating are really missing the point of this device. This is really a switch like controller that runs android so it can run remote play apps or cloud gaming apps (though much more comfortable to hold then a switch with better battery life.) if you want a device that can do emulation and full console gaming but portable you will definitely want to look elsewhere for something like a price subsidized steam deck, or Retroid device or any of the other smaller emulation designed devices would better suite you.I however was looking for a high quality, portable sturdy second screen with good controls  and good battery life which 12 hours is hard to beat. (Yes you can do with with an iphone / ipad or android phone / tablet but if you have tried that like i have you will find the screen size to be too small with thick black bars to make a 16:9 aspect ratio that is standard with TVs or for the case of tablets too large and now sitting on a table bluetoothed to a controller.) This device out of the box (at least for xbox, playstation requires a 3rd party app called PSPlay as the Sony official app doesn’t support the g clouds controllers yet (maybe with an update to Sony's app))  will take your console and make it portable just be sure to have wifi 5 (which is the wifi spec on the g cloud) or greater as this all requires a lot of local bandwidth on your personal wifi network.I found for the best results i had to hard wire my consoles over LAN and then to use my eero wifi 6 system as the final wireless step to the g cloud, i have had almost no artifacting, latency issues, or  ghosting since switching to this setup notice i didnt say none.. just 99% perfect streaming. Even with other traffic on my network like my partner streaming movies over apple tv etc. this setup performs almost perfectly enough to think its happening on device.I did initially try to use the PS4 pro and Xbox S on wifi, and while the xbox s’ modern wifi worked great, the ps4 pro’s was not good, downloading or updating software while trying to remote control the console would resort in artifacts and issues. I mostly blame Sony’s` wifi in the ps4 pro as even when it was connected to the tv i had issues with it.  The minute i put it on LAN all those issues went away and it was as if the G cloud was directly connected to the PS4 Pro i was able to crank up PSPlay’s streaming settings to max and the gaming became buttery smooth. Microsofts Xbox App does a lot of the work for you when it comes to remote play and is frankly superior to sony’s app and even the 3rd party PSPlay (which is an improvement on the official Sony one.) The xbox app  will automatically scale the graphics quality based on current wifi and other factors to smooth out the experience so, while not unusable as the ps4 pro was over wifi, it was just not a perfect experience but still playable! But, again for best results hardwire LAN to the xbox s and then wifi 6 to the g cloud for buttery smooth, full hd, no artifacting or noticeable lag while gaming.I did try some Xbox Cloud Gaming but found that to be sorta redundant as I have a console in my home but i guess the option is nice if you don't.. however the streaming was only ok in my opinion. I have fios fiberoptic gigabit internet with wifi 6 and i still had artifacting and some lag, while playable for non timing critical games definitely not a perfect or optimized experience. It just seems at this time that game streaming from servers outside the home is just not ready for prime time in my opinion.I think playing my consoles on g cloud is going to replace playing my consoles on my tv as I prefer the handheld form-factor and casualness of just picking up and playing like the switch but the graphics of the better consoles really pop on the 7” screen which is really the star of the show. The screen really is good for a LCD, the black levels are good, colors pop and it gets very bright! Hard to find something like this with this battery life.The android version on the device is basic but the addition of tablet mode means you can multitask (something you cant do in the “console ui”) The device software in its current revision lacks screen mapping of the controls so android games will run but wont take advantage of the extra hardware buttons and sticks (this is something that can be added with 3rd party software but as I only use this as a console portable screen I have not tried this, as all the software I use is designed for the controls or has control mapping) this is apparently  not good if you want to run games natively on the device but with its specs it wont really do a good job at that.This device really has been narrowly designed for streaming games and its processor does an amazing job at that for 12 hours but your milage playing game software locally will vary (not that i have tried just seen other reviewers attempts.)"
"Xbox Wireless Headset - Bluetooth Connectivity - For Xbox Series X|S, XBX1, & Windows 10 - Enhanced auto-mute and voice isolation - Dolby Atmos, Windows Sonic, and DTS Headphone: X - Up to 20 hr b",US$109.99,2.6,https://www.amazon.com/-/es/Xbox-Wireless-Headset-Connectivity-Consola-videojuegos/dp/B0DH689JGY/ref=sr_1_40?__mk_es_US=%C3%85M%C3%85%C5%BD%C3%95%C3%91&dib=eyJ2IjoiMSJ9.xkm0kH5DkRAHwvFY7ZBCe3Pu4Qobte2p4nQVdb93cw1Mdmwjjo1Sh52pG0VitNm8leA_PVvlIwvKDQ4qiY10mv5YuXwBMW6KfasfZyEMMM2QCAliiveN9CrHXbEZHMNTP1kjmF2IdCYbEMgWWxbYBplmcBYWSJEXEMsKIlhDC0-9yKj-eMXkZZ_WLXNjyzdGYOsEswvr1ilqoB5dw5ny9rmAicqF-g6c0MyeAp3nUXk.0WkInoihowCI06tmQsEhzU6T-ej_AXmBS6Yu747KX4w&dib_tag=se&keywords=xbox&qid=1731040845&sr=8-40,"Sound consistency///Pretty annoying navigating the menus and almost every selection sound queue comes with a static noise in my ear. Straight out the box and after updating. How do they even release this product with such issues///Very good sound for the price///Build feels solid, mic sounds pretty good, it's quite comfy(a little discomfort on the top of the head but I'm sure it's just getting used too and breaking it in), and I'm blown away by the sound. It's a little bass heavy but you can tune it in the settings. Seriously though these sound better than my $150 Sennheiser's that aren't gaming headphones. Really impressed. Great soundstage and it really feels like a home theater on the ears.Will say I had an issue with the mic not working in game even though I could hear it on the monitor but it seems to be fixed after talking with support and doing a power refresh cycle where I took the account off, powered down and unplugged everything from the Xbox, waited 2 minutes, started it up and added back the account but made sure not to import the old settings when prompted. The service guy said that something may have become corrupted. It seems too be working now! Will keep you posted!///It doesn’t work///I get sound from my phone through the headset but absolutely none from my Xbox which is like the one thing that should work.///Audio delay///I love the clean design, comfort, and native Xbox integration. The controls are well integrated with large dials that are easy to interact precisely with, as opposed to the small fiddly controls on other headsets.Audio quality out of the box is disappointing. Similar to the original Xbox Wireless Headset, very heavy on the low end making for a muddy/muffled sound. I imagine this can be somewhat corrected using EQ settings, but a headset should sound good and balanced out of the box. The nail in the coffin is that the audio latency, just like the original, is still worst in class. It is especially noticeable in a shooter like COD where you pull the trigger, see the weapon fire on screen...and then you hear the gunshot a beat later. It's immersion breaking and actually puts you at a disadvantage in competitive games that rely on audio cues, as well as rhythm games.///Good headset…eventually///I had to return the first one I received after talking with Microsoft support for hours because the headset would not receive any sound from the console. The second one worked much better and I’m very happy with it. Very good sound and the ability to mess with the equalizer for fine tuning. Easy to mute the mic and also has very convenient knobs for volume control and game/chat audio tuning.///Connects but no sound///I was able to pair the headset with my iPhone and it worked but no audio when connected to the Xbox. I contacted support and we were unable to get it set up. The audio didn’t sound great when connected with my iPhone either.///Great sound, great comfort, poor build quality///This headset is absolutely perfect in every facet except for one. This headset has great sound quality, great comfort, and it’s very easy to use and setup. Unfortunately, about 3 months after my purchase, the plastic part of the headband closest to the earmuff broke away from the earpiece. the headset is still usable and still fairly comfortable. If you want a good wireless headset for a fairly good deal, pick these up. Just be sure to be gentle with them///Save your money///Recently bought one via the Microsoft app and when I finally got it was broken. No audio was playing and kept disconnecting from my series x.///Cut in and out when the audio gets busy///I loved my old Microsoft wireless headset but as the years went by it did start to cut out and create distortion sounds when the gameplay got busy. I was super excited to see this updated version and decided to give it a go. This headset is doing the exact same thing as my old one except there are no distortion sounds. It does cut in and out a lot when the gameplay gets busy. I have tried it with Diablo 4, rust, and dayz and it's fine mostly for those games but one I started to play black ops I couldn't even hear what was going on in the game because it's cutting in and out so much. I had to return it as much as it pains me. I will be purchasing the steel series as my husband never has any issues with his."
"WD_Black Tarjeta de expansión C50 de 1 TB, con licencia oficial para Xbox, reanudación rápida, Plug & Play, expansión NVMe SSD para consolas de juegos Xbox Series X|S - WDBMPH0010BNC-WCSN",US$144.99,4.8,https://www.amazon.com/-/es/WD_Black-expansi%C3%B3n-licencia-reanudaci%C3%B3n-consolas/dp/B0C44XVWCH/ref=sr_1_42?__mk_es_US=%C3%85M%C3%85%C5%BD%C3%95%C3%91&dib=eyJ2IjoiMSJ9.xkm0kH5DkRAHwvFY7ZBCe3Pu4Qobte2p4nQVdb93cw1Mdmwjjo1Sh52pG0VitNm8leA_PVvlIwvKDQ4qiY10mv5YuXwBMW6KfasfZyEMMM2QCAliiveN9CrHXbEZHMNTP1kjmF2IdCYbEMgWWxbYBplmcBYWSJEXEMsKIlhDC0-9yKj-eMXkZZ_WLXNjyzdGYOsEswvr1ilqoB5dw5ny9rmAicqF-g6c0MyeAp3nUXk.0WkInoihowCI06tmQsEhzU6T-ej_AXmBS6Yu747KX4w&dib_tag=se&keywords=xbox&qid=1731040845&sr=8-42,"Amazing and worth the penny///The Xbox Storage Expansion Card is an excellent accessory for Xbox Series X and S owners who need more storage without sacrificing performance.PerformanceThis card delivers exceptional speed, matching the internal SSD’s performance. Games load quickly and run smoothly, ensuring a seamless gaming experience.InstallationSetup is a breeze—simply plug it into the dedicated slot, and the console recognizes it instantly. It’s incredibly user-friendly, making it accessible for gamers of all experience levels.DesignIts compact design makes it easy to carry, ideal for gamers who travel or switch between consoles frequently.PriceThe main drawback is the price. While the performance justifies the cost, it may be considered high compared to traditional external drives.CompatibilityKeep in mind that this card is specifically designed for Xbox, so it won’t work with other systems.ConclusionOverall, the Xbox Storage Expansion Card is a great investment for serious gamers looking to expand their storage efficiently. If speed and ease of use are your priorities, this card is definitely worth the purchase.///Easy to use and as fast as internal!///I recently purchased the WD_Black 1TB C50 Storage Expansion Card for my Xbox Series X, and I must say it has been a game-changer in terms of storage convenience. The ease of use is one of its standout features. All I had to do was plug it into the dedicated expansion slot on my Xbox Series X, and it was instantly recognized and ready to use. No complicated setup or lengthy installations – it was truly a plug-and-play experience.What really impressed me, though, is that this storage expansion card matches the speed of the internal SSD in my Xbox Series X. I was worried that an external drive might compromise load times and game performance, but with the C50, I noticed no difference at all. Games load just as quickly as they do from the internal storage, and I can seamlessly switch between titles without missing a beat.The 1TB capacity is a significant boost to my storage capacity, allowing me to maintain a vast library of games without constantly juggling which ones to keep installed. This has improved my gaming experience, especially in a world where game file sizes keep growing.Overall, the WD_Black 1TB C50 Storage Expansion Card has made expanding my Xbox Series X's storage a breeze. Its ease of use and matching internal SSD speed make it a no-brainer for anyone looking to enhance their gaming experience without sacrificing performance. It's been a great addition to my setup, and I highly recommend it to fellow Xbox gamers.///It WORKS!///I got this for my boyfriend so we could download more games on his Xbox X/S or whatever it’s called (I really don’t know). He literally plugged it in, went to the settings and added it as an item I suppose and immediacy it took it and said he gained the storage! I will say it’s not 1 full TB, it was like 966 or something of that range but that’s basically a terabyte no? Regardless it worked, he was able to download all his favorite games and the games we wanted to play together even though I’m not the biggest fan of playing (just watching lol). So yes! It works, it’s awesome and he was super duper happy about it.Im unsure of the price of what this should be on other sites or brands but I felt that this was worth it! He gets to download literally everything he wants with more to spare, it was super easy, convenient, and since he downloaded all the games onto the SD card itself (you can choose) if I’m right, he can take it out and bring it elsewhere and keep all his data. So points for compatibility and portability. The design is super sleek, literally can’t see it, and the quality is outstanding!///Fast drive with plenty of space.///I purchased this drive for my Xbox and I am beyond happy with it. It allows me to install and run my games from this drive and they worked perfectly while running from this.///Review///Great product, real storage 920 GB which is real good, fully compatible, overall happy with the purchase.///Pretty useful, but pricey///Got it on sale during prime day, still a bit over $100. I wish you could add your own like on PS5, but this is still really good, just a bit expensive. Performance is on par with internal storage.///Works excellent///Great product.Easy to use.It can be formatted for multiple consoles.Really plug and play///Great storage expansion card, but not a full TB///Works as advertised and works great playing X/S series games from in but you only get 920GB of storage and 919.9GB after you format the storage. I know it’s only 80GB probably used for whatever makes it works but you pay for 1TB? You should have the whole 1TB to use.  WD storage card is great, and I would buy it again. I wish WD made a 2TB or bigger storage card.///Works just fine///Does what it's meant to do, at a better price than the only other option from Seagate.///Ótimo produto///Produto veio bem embalado e sem danos. Funciona 100% no Xbox series S///Ótima qualidade///Mesmo sendo muito caro ainda , ainda sim é uma ótima alternativa para expandir a memória do Xbox , pode comprar sem medo , fácil de usar , sem erro .///Fonctionne très bien !///Mis en place sur la Xbox série X !Fonctionne très bien ! Aucun ralentissement sur les jeux ! Compatible avec les jeux séries X !"
"Auriculares para juegos de PS5, PS4, Xbox, PC, auriculares para niños con micrófono para suministros escolares, auriculares para juegos con cable, auriculares con micrófonos, auriculares para juegos",US$18.99,4.2,https://www.amazon.com/-/es/sspa/click?ie=UTF8&spc=MTo0ODE2NTcxMzMzODQyMDQ2OjE3MzEwNDA4NDU6c3BfbXRmOjMwMDEwNzAzOTQwNjcwMjo6MDo6&url=%2FAuriculares-auriculares-micr%25C3%25B3fono-suministros-micr%25C3%25B3fonos%2Fdp%2FB07BMZPHCX%2Fref%3Dsr_1_43_sspa%3F__mk_es_US%3D%25C3%2585M%25C3%2585%25C5%25BD%25C3%2595%25C3%2591%26dib%3DeyJ2IjoiMSJ9.xkm0kH5DkRAHwvFY7ZBCe3Pu4Qobte2p4nQVdb93cw1Mdmwjjo1Sh52pG0VitNm8leA_PVvlIwvKDQ4qiY10mv5YuXwBMW6KfasfZyEMMM2QCAliiveN9CrHXbEZHMNTP1kjmF2IdCYbEMgWWxbYBplmcBYWSJEXEMsKIlhDC0-9yKj-eMXkZZ_WLXNjyzdGYOsEswvr1ilqoB5dw5ny9rmAicqF-g6c0MyeAp3nUXk.0WkInoihowCI06tmQsEhzU6T-ej_AXmBS6Yu747KX4w%26dib_tag%3Dse%26keywords%3Dxbox%26qid%3D1731040845%26sr%3D8-43-spons%26sp_csd%3Dd2lkZ2V0TmFtZT1zcF9tdGY%26psc%3D1,"Beware. make sure its not used///The box came open and the product sometimes works but sometimes does not work. it's not my device as I have checked thoroughly. I work remotely from home so it's unfortunate that this is not a product that is stable in the workplace as I used it to help facilitate my vocational practice. but when it does work, omg, its amazing!! there's no echoing or static sound, you don't hear yourself as you speak, the cushioning around the ears are perfectly snug so there's no external noise distracting you. It's literally amazing when it does work. I pick the color pink and it's exactly as advertised on the visual display. It's a matte pink. It's super cute. a bit too snug if you plan to wear it for hours at a time but im sure it will loosen over time to fit a persons head. Too bad they gave me a bonk product, honestly bummed.///Amazing///Great Seller, item better than description, glad to have purchased item from this seller, would highly recommend Seller///Great for the price///I bought this headset 3 years ago on a super small budget and after 3 years it just started to break it started peeling a while ago but for the price this headset is really good and worth it///Honest opinion///Honestly I have pretty much nothing bad to say about these. The sound is good not great but still passes for me. Obviously you will not compare it to a turtle beach or whatever. The fit is great for me and lightweight. I played for 3 straight hours and didnt bother me much at all. The fabric on the cord is really nice and durable and its straight plug in play 3.5 mmj. the only bad is the mute switch. It did not work on having to mute it. That is it! Doesnt bother me at all because I'm not into chatting or whatever. I gave it a 4 stars for it. Almost perfect but you get what you buy. I have had it for almost a month not and works as it should. I definitely recommend if you are a beginner or want a budget headset.///Great headphones for kids and adults///Theya re Greta headphone with great sound quality. They are adjustable on each side to make smaller or bigger. The mic works very well and you can turn it on or off. The cord is a good size length no matter what they are using it for. I would highly recommend these headphones!///Broke pretty quickly///The first day I got the headset, everything worked great. By the second day, the right ear piece volume started cutting in and out, especially if the cord was moved any. Then by the 4th day the right ear piece was completely dead and only sound in the left ear and the mic (which would occasionally cut out from time to time) and now not even a fully week later with the headset and the left ear piece is cutting out and back on like the right side was doing so I assume a matter of time before it's completely useless and broken and I always take great care of my gaming equipment.///Doesn't last and VERY UNCOMFORTABLE///The headphones are cute and functional in the short term, but there are some issues. The headphones consistently hurt my ears after about an hour of use. Stuffing cotton in the ear area has helped, but they're still uncomfortable to wear and painful after a few hours. After about six months of use, the microphone began cutting out, and after ten months, the microphone is basically unusable. After eleven months, there is a loud static in the right ear that won't go away. They were okay for a while, but I would strongly suggest investing in better headphones for your own sanity.///Perfect for school///It’s working fabulous for my grandson in Kindergarten!!!!  Better than I could imagine!!!///Loved it///Thank u///جميلة جدا///لون جميل واداء جميل شكرا///Good for the money///My grandson love them///It works!///I liked that the mic worked and when you take a video other sounds from around still appear so the noice cancellation is not really that good.///Headphones work, not microphone///Bought 3None of the microphones work on the xbox one."
