Producto,Precio,Estrellas,Link,Reseñas
Xbox One S 500GB Console (Renewed),US$209.99,4.2,https://www.amazon.com/-/es/Xbox-One-S-500GB-Console-Renewed/dp/B07BHR83RX/ref=sr_1_24?__mk_es_US=%C3%85M%C3%85%C5%BD%C3%95%C3%91&dib=eyJ2IjoiMSJ9.C_SFs_0mf-F0yWkZ_Kc5XdzIh4Cbu0gWn7iNNrV3YLbK6V1XXpYR0uweYZm80Gt_pGRnm6d79wlnGfjQLnwusTJjoWqZSvTnCPZ4Cn0pyTyPfCZu3__PNlOU9IHj7awpPjtsSHbfo2dpq5SLl5pVd3vHaeUwyO_Q9L-Dp5W5RDXmapDmViiVZJJJ8_5zo33z.wCh2TOy_m4-2yhuytxdR2HSn8r4hQ-5pHRFihD8dJMU&dib_tag=se&keywords=xbox&qid=1731040842&sr=8-24,"Nice, refurbished console with a generic controller///The item was as described, and shipping was pretty fast. Console was clean and was wrapped in bubble wrap and double boxed. Came with a 3rd party controller and wires. It took some time to setup from the factory reset. No issues with the console or controller.The controller that came with was a 3rd party controller which does work but you can feel the cheapness of it. The buttons are very clicky and occasionally it will miss an input. Overall, I'm very satisfied with the purchase. It's probably a good idea to invest in an actual Xbox controller. Since I am playing fighting games on mine, I will be looking at arcade sticks as well.The 500GB model can fill up pretty quickly when you are installing games so it will limit your library at times.Bonus: when I was checking the system, I pressed the eject button for the disc drive and it actually had a copy of Grand Theft Auto V in the drive!///Great Product///Works great!///So far so good///Seems to work great///does not turn on/work///probably power outlet is broke everything can be plugged in and nothing will turn on wasted my time///Cool item///My kids use this every single day! Great product///It came early today and thanks///I like it///Works great but controller drift ruined it///The console was great and I got to play mercenaries. Controller drift was unreasonable. Ask them to send me a new controller, but they said I had to return it. I doubt I'll be bothered to buy another after I set it up with games and settings.///Works just fine///The console has been working for a few weeks now - no complaints.///Excellent///Excellent condition and a free game also. Works perfectly.///Does exactly what it's supposed to///Fast delivery, no issues. Was bought as a replacement. Been working for a couple of weeks, perfectly fine.///Fast speedy service///Very happy. Xbox came ready to plug in and go!! I took one star off only because it was quite dirty. Apart from that can’t fault it at all!///Smokey Xbox!///Purchased for my daughter as the description sounded fine but when I received the item and opened up the box I was hit with an awful smell of cigarette smoke. The Xbox was yellow and smoke stained. The plug for the mains was brown and everything smelt so bad. It was awful and should never have been up for sale in the first place.///Replacement console///Plugged it in and set up. Has worked well up till now, no problemsMy old console just stopped workingThis console up till now is good value"
"2021 Microsoft Xbox Series S 512GB Game All-Digital Console, One Xbox Wireless Controller, 1440p Gaming Resolution, 4K Streaming, 3D Sound, WiFi, White (Renewed)",US$310.23,4.6,https://www.amazon.com/-/es/Microsoft-Xbox-All-Digital-Controller-Resolution-S/dp/B09ZJ9L6Z2/ref=sr_1_25?__mk_es_US=%C3%85M%C3%85%C5%BD%C3%95%C3%91&dib=eyJ2IjoiMSJ9.C_SFs_0mf-F0yWkZ_Kc5XdzIh4Cbu0gWn7iNNrV3YLbK6V1XXpYR0uweYZm80Gt_pGRnm6d79wlnGfjQLnwusTJjoWqZSvTnCPZ4Cn0pyTyPfCZu3__PNlOU9IHj7awpPjtsSHbfo2dpq5SLl5pVd3vHaeUwyO_Q9L-Dp5W5RDXmapDmViiVZJJJ8_5zo33z.wCh2TOy_m4-2yhuytxdR2HSn8r4hQ-5pHRFihD8dJMU&dib_tag=se&keywords=xbox&qid=1731040842&sr=8-25,"from AOP3D : 🌟🌟🌟🌟🌟  Wow, where do I even begin with the Xbox Series S?///🌟🌟🌟🌟🌟Wow, where do I even begin with the Xbox Series S? This console is an absolute game-changer (literally)! As a gaming enthusiast, I couldn't be more thrilled with my decision to pick up the 2021 Microsoft Xbox Series S 512GB Game All-Digital Console. Let me break down why this is easily a 5-star product.Firstly, the design is sleek and modern. The Xbox Series S is compact, making it a perfect fit in any entertainment setup. Despite its smaller size, it packs a punch. The performance is outstanding, delivering impressive graphics and lightning-fast load times. Jumping into games is seamless, and the enhanced visuals truly elevate the gaming experience.The 512GB SSD is another highlight. It's ample storage that allows me to download and enjoy a wide range of games without worrying about running out of space. Plus, being an all-digital console means no more clutter of physical game discs. The convenience of accessing my library instantly is a huge plus.Let's talk about the gameplay. Whether I'm exploring vast open worlds, engaging in intense multiplayer battles, or enjoying story-driven adventures, the Xbox Series S handles it all flawlessly. Games run smoothly, and the 120fps support adds a new level of immersion. The controller is comfortable and responsive, enhancing the overall gameplay experience.One of the standout features of the Xbox Series S is its compatibility. Not only does it support a vast library of Xbox One games, but it's also optimized for Xbox Series X|S titles. With Xbox Game Pass Ultimate, I have access to a treasure trove of games from day one, including new releases. It's like having a gaming paradise at my fingertips.The user interface is intuitive and user-friendly. Navigating through menus, managing downloads, and accessing settings are straightforward tasks. The Xbox ecosystem seamlessly integrates with other devices, allowing me to stream games to my smartphone or PC effortlessly.Furthermore, the Xbox Series S is more than just a gaming console. It's a complete entertainment hub. From streaming services like Netflix and Disney+ to music apps like Spotify, I can enjoy all forms of digital entertainment in one place.In conclusion, the 2021 Microsoft Xbox Series S 512GB Game All-Digital Console is a must-have for any gamer. It offers exceptional performance, impressive graphics, ample storage, and a vast library of games. Whether you're a casual gamer or a hardcore enthusiast, this console delivers an unmatched gaming experience. I can't recommend it enough! If you're looking to level up your gaming setup, look no further than the Xbox Series S. It's pure gaming bliss.🌟🌟🌟🌟🌟///Good///It actually was ok not bad everything works perfectly///Incredible value!///Admittedly, I bought this just for Starfield, but I have been playing Fallout 4 (thanks Oppenheimer!), and I can't stop thinking about it. The Xbox Series S is one of the most underrated consoles because, by a landslide, it has the most bang-for-your-buck. I have been playing my Nintendo Switch for the last 3 years, but once I started using this, I have been obsessed!Although the library is not as impressive as that of the Switch or PS5, it has actually been good for me because I am spending more time actually PLAYING games rather than contemplating which games to play on my backlog.I do understand that this is not for everyone. I suppose that if you have already been ""spoiled"" with top-line graphics, this would feel like a downgrade. However, because I bought this for Bethesda games, I could not be happier.Although it might not have the largest library and only slightly inferior graphics than a PS5 (although I don't notice), this console makes up for those shortcomings with it's lean performance. Although it does ""less,"" everything it does is exceptional and meaningful.The only bad thing is that some games did not run properly when I first booted up the console, but after I power-cycled (turn it off for 10 seconds, unplug for 10 seconds, then start it again), everything runs silky smooth.///Happy camper///Bought the gaming system for my nephew. Which I know nothing about lol. All I know is that he wanted an Xbox. Went to the store to purchase a game of his choice to find out this system is digital meaning you can only purchase games online and not the actual disk. Well after a few days of thinking about it, I thought that was the best thing ever! No more lost or scratched games. So now we just go online and purchase all his games and dont have to worry about anything getting scratched or lost. Also, we have access to the gaming store which allows his access to over 100s of kids games that he really enjoys playing. Win win for this aunt!///I love it///I always wanted one for Christmas mommy, thank you so much for buying this present.///Good and affordable///If you want the new gen Xbox’s but can’t get the X, this is for you.///Works amazingly///OMG I was so nervous to buy the refurbished one but, it works so perfectly.///EXCELLENT///Loved this product so much but my husband loved it more for his birthday !///Seems Brand New///I've only had the console for a couple weeks, so I can't comment on how things will go long term, but so far everything seems to be working perfectly well. The box makes it clear that this is a refurbished console, but my experience so far has been like getting a brand new console. From little things like the presentation being well-considered, everything fitting snug in the box, to the fact that there isn't a single ding or scratch or anything on either the console or controller.Can't guarantee your experience will be exactly the same, of course, but, so far, I have zero regrets buying refurbished. As my headline says, it seems brand new.///Works///Fast loading times, good graphics, not much left to be desired. Overall a good budget xbox.///Incredible Purchase!///Although its refurbished, it feels and looks completely brand new. It plays like a dream and has no issues so far. Don't regret this purchase one bit///Do not purchase///Picked the referbished unit for the savings. Worth the price. Came with the full warranty. Controller looks new. Was the price of a used one on the local buy and sells, and has warranty. A no lose situation.Update, controller drift after 40 days. Amazon will not accept return and Microsoft will not warranty. DO NOT PURCHASE****///Super///Mon fils l’adore"
Xbox Series X (Renewed Premium),US$399.99,3.7,https://www.amazon.com/-/es/Xbox-X-Renewed-Premium/dp/B0C72SK3P8/ref=sr_1_27?__mk_es_US=%C3%85M%C3%85%C5%BD%C3%95%C3%91&dib=eyJ2IjoiMSJ9.C_SFs_0mf-F0yWkZ_Kc5XdzIh4Cbu0gWn7iNNrV3YLbK6V1XXpYR0uweYZm80Gt_pGRnm6d79wlnGfjQLnwusTJjoWqZSvTnCPZ4Cn0pyTyPfCZu3__PNlOU9IHj7awpPjtsSHbfo2dpq5SLl5pVd3vHaeUwyO_Q9L-Dp5W5RDXmapDmViiVZJJJ8_5zo33z.wCh2TOy_m4-2yhuytxdR2HSn8r4hQ-5pHRFihD8dJMU&dib_tag=se&keywords=xbox&qid=1731040842&sr=8-27,"Excellent condition///Look brand new///Didn't work///I purchased this renewed PREMIUM thinking I was getting a like new product. Unfortunately, the moment I set it up it started shutting off due to overheating. I did not have it for more than 24 hours. The return process was easy but very disappointed that I have to wait put o 30 days for my refund. I do not recommend this product and suggest you save to get a new Xbox.///Not bad///It's in good condition but I constantly wonder what might go wrong///Brand new///Bought a ""like new"" xbox series x well minus the original packaging everything came brand new no grime packaged very nicely and neatly no issues visuals are great came with a brand new series x controller no sign of any wear on the xbox what so ever signed in with my account and it gave me Diablo 4 for free!!! It didn't even mention that on any other reviews or descriptions///Works great///Well packed, works great and not single mark shown of being used before. Would totally buy again.///Don’t work correct///Have a problem when I was playing a game this conosile just freeze///DO NOT BUY!!///Would not even turn on!!!! Much less others complaints of games quitting!!"
Microsoft Xbox One Special Edition inMatte Blackin 500GB (video game)(Renewed),US$177.80,3.5,https://www.amazon.com/-/es/dp/B01MF7056U/ref=sr_1_28?__mk_es_US=%C3%85M%C3%85%C5%BD%C3%95%C3%91&dib=eyJ2IjoiMSJ9.C_SFs_0mf-F0yWkZ_Kc5XdzIh4Cbu0gWn7iNNrV3YLbK6V1XXpYR0uweYZm80Gt_pGRnm6d79wlnGfjQLnwusTJjoWqZSvTnCPZ4Cn0pyTyPfCZu3__PNlOU9IHj7awpPjtsSHbfo2dpq5SLl5pVd3vHaeUwyO_Q9L-Dp5W5RDXmapDmViiVZJJJ8_5zo33z.wCh2TOy_m4-2yhuytxdR2HSn8r4hQ-5pHRFihD8dJMU&dib_tag=se&keywords=xbox&qid=1731040842&sr=8-28,"It’s actually better than the one it’s replacing///Zero complaints,everything is as advertised and in perfect working condition.now I’m gonna call out of work and catch up on gaming lol///Terrible machines 3 in row now work///I have had 3 machines all with replacement instead of returns . First one system error message , 2nd didn’t even turn in and now the 3rd is overheating horrible company, horrible service. Can’t get ahold of anyone this is absolutely ridiculous. And this is Amazon trusted and rest. Yea right Amazon falling apart just cares about money ever. There deliveries aren’t on time any more. DO NOT ORDER FROM HERE///Amazing replacement.///I purchased this to replace my daughters 2014 XBox1.Works great, no problems whatsoever.Would buy this again!///Shipping Issues but Console is Great///Im half American/British and just moved back to the states after 7 years away. I needed a new console so decided to go with the cheaper option and got an Xbox over PS. The Xbox was supposed to come Aug 1st but it didn't show up till Aug 7th. It's not the sellers fault as it was an issue with USPS but still was annoying. As for the console itself, it works great. It came with a power and HDMI cord so was able to quickly set it up. Bought GTA to go with it and it read the disc fine and promptly downloaded the game. Also you get the first month of Game Pass Ultimate for just $1 if you are making an Xbox account for the first time. I definitely recommend this if you are looking for a more cheaper option but want a good working system.///Good console///To be honest I was expecting to have some kind of issue, but I did not. Console came with everything it was supposed to, all items were in good condition. I plugged in, turned on, ran through the initial setup then it started updating for about 30 mins. All in all, I’m pleased with this order.///Don’t buy!///Nothing worked on this Xbox. It came in and I plugged it up same day and no light came on the front and it only made sound. It never showed up on the tv the controller it come with also didnt work. They say it came through a third party company , but Amazon says it went through their department and was checked and serviced and it hadn’t been.///My husband and kid can play again 😂///This Xbox was purchased from Amazon as an Amazon-renewed and it works great 👍; we bought it as a replacement for the Xbox 1 that died after much wear and tear over years of playing with it. 👍 to the Amazon renewal team!!!///Ok///Just came in today and my sons been on it for about an hour, so far the system works fine but the controller doesn't so until I can go get a new one we can't really tell."
Xbox One S (Renewed),US$259.99,4.0,https://www.amazon.com/-/es/Xbox-One-S-Renewed/dp/B08NCJP9GC/ref=sr_1_29?__mk_es_US=%C3%85M%C3%85%C5%BD%C3%95%C3%91&dib=eyJ2IjoiMSJ9.C_SFs_0mf-F0yWkZ_Kc5XdzIh4Cbu0gWn7iNNrV3YLbK6V1XXpYR0uweYZm80Gt_pGRnm6d79wlnGfjQLnwusTJjoWqZSvTnCPZ4Cn0pyTyPfCZu3__PNlOU9IHj7awpPjtsSHbfo2dpq5SLl5pVd3vHaeUwyO_Q9L-Dp5W5RDXmapDmViiVZJJJ8_5zo33z.wCh2TOy_m4-2yhuytxdR2HSn8r4hQ-5pHRFihD8dJMU&dib_tag=se&keywords=xbox&qid=1731040842&sr=8-29,"Great Performance///My Xbox One S Renewed works just like new! The controller and console look brand new! It's fast speed to download games, run graphics of each game, and do everything it's supposed to just like a new one is greatly appreciated! I will definitely buy from this company in the future!///Excellent experience///Came in all its original packaging. A+++ experienceFast shipping and a quality product///Constant problem with the refurbished xbox S///I purchased 2 xbox 's  .  One was good and the other was constantly giving me problems.  We had to send the remote control back 1st and in 2 months it did not work (the replacement one).  For the last 5 months I had problems with the xbox freezing up (after receiving the replacement for a totally bad one and now it won't turn on.  I spent good money and am tired of wasting so much time and buying new controllers.///Excellent///Great price everything looked and worked like it was brand new. Thanks alot!///Works As It Should///We had 2 XBoxes in our home- one original XBox One, and one newer like this. After about 10 years, the original quit working.I don't play very often, so I didn't want to spend a ton of money on a brand new system. After looking a bit, I decided to take a chance.This works just fine, no issues connecting it, setting it up, downloading content, etc.I did remove one star from my review because it came with the wrong power cord. The one it came with didn't fit at all, it was clearly for a different device, so I had to spend an additional $7 for a new cord, and wait for that to be delivered as well. Not the end of the world, just an annoyance.///Good///I like that it was delivered with care and fast. Everything was still sealed and like new///It works perfect///I absolutely have nothing to dislike about it, my son loves it and he is happy to start gaming. He is mostly using it for gaming and fun with his friends.///Did not work///Arrived timely, but would not connect to the wireless remote, and would not stay powered on. Amazon and seller is sending a replacement. Not as timely as we received the first one, guess we will see how the 2nd one does. Will update once we receive and can test. Hoping 2nd time's a charm."
"DXKK Rechargeable Batteries for Xbox One/Xbox Series X|S, Battery Pack for Xbox One S/One X/One Elite Controllers Battery, 2x5520mWh Batteries Pack for Xbox Accessories",US$17.99,4.7,https://www.amazon.com/-/es/sspa/click?ie=UTF8&spc=MTo4Mzg5MzI3NjU2NDUxNDc0OjE3MzEwNDA4NDI6c3BfYnRmOjIwMDAzNzA1NzQ0NDA5ODo6MDo6&url=%2FRechargeable-Batteries-Controllers-2x5520mWh-Accessories-360%2Fdp%2FB09QHJH89D%2Fref%3Dsr_1_32_sspa%3F__mk_es_US%3D%25C3%2585M%25C3%2585%25C5%25BD%25C3%2595%25C3%2591%26dib%3DeyJ2IjoiMSJ9.C_SFs_0mf-F0yWkZ_Kc5XdzIh4Cbu0gWn7iNNrV3YLbK6V1XXpYR0uweYZm80Gt_pGRnm6d79wlnGfjQLnwusTJjoWqZSvTnCPZ4Cn0pyTyPfCZu3__PNlOU9IHj7awpPjtsSHbfo2dpq5SLl5pVd3vHaeUwyO_Q9L-Dp5W5RDXmapDmViiVZJJJ8_5zo33z.wCh2TOy_m4-2yhuytxdR2HSn8r4hQ-5pHRFihD8dJMU%26dib_tag%3Dse%26keywords%3Dxbox%26qid%3D1731040842%26sr%3D8-32-spons%26sp_csd%3Dd2lkZ2V0TmFtZT1zcF9idGY%26psc%3D1,"Fast af///The case is durable and great for travel, the batteries are long lasting, it charges incredibly fast, not even taking 20 minutes to go from dead to 100, and the case looks really good with the rest of my setup///Best purchase I've made for my husband!///These batteries have an excellent battery life (they hold up much longer than regular rechargeable batteries). He games about 3 hours a day and these batteries last about a week on a single charge. The pack easily snaps snugly into the charger. It's great to just swap out one battery and insert the next and you're ready to go. They charge up quickly, definitely better than buying batteries or rechargeable AA batteries. Great value for your money. Charging connections are built-in USB, type C, or micro.///New battery///Works good and hold a good charge///Works great///This 4 battery xbox controller charger with 4 2600 batteries is great. The batteries seem to last for days (a day being 24 hours, not a couple of hours a day) of continuous play. (I have put it to the test as a gamer)It is a METAL case and it closes securely. I would be happy to take it in a pocket or bag anywhere. (Except the beach of course. 😉)I am only giving it 4 stars because the clips that the batteries click into (the charging connectors) on this one were a little loose on the batteries. I had to take something small and pull them out a little for them to charge the battery correctly. So far that was only on 2 batteries. The other 2 seem snug enough. I can turn it upside down, open, now, and they will not fall out.It was very slight. But should not have been unecessary. I do not know if it had been sitting somewhere a long time or was manufactured like that, but it is no longer an issue.It charges well, and the 4 lights in the middle indicate which one is charging.It comes with its own charging cable attached AND is designed for it to tuck around the edge.All in all this is a great charger and batteries.If i need more batteries (like if we increased our number of controllers), i will definitely buy another one of these.///Excellent battery life///These batteries have a excellent battery life, very easy to use, my boys are huge gamers and practically live on their Xbox on the weekends, and these batteries last them about 2 to 3 days on a single charge and charge up fast as well, definitely better then buying batteries or the rechargeable AA batteries. Oh and the best part is they have different ways of charging them like 3 different ways I think we just hook up to the back of the Xbox or plug into my phone charger when we are somewhere else but definitely 10 out 10 on this set. Great value for your money.///Great batteries can’t beat the price///I ordered these on a Sunday received them on Monday so very fast delivery they do not need there own battery cover as well there longer lasting than some of the other batteries and they have a great price you can’t beat that plus three ways to charge them you can’t beat that///Great all around quality.///Battery life is great. They most definitely last longer than standard AA batteries do. They fit perfectly as well. I really like the closing case with the charger attached to it, very convenient. It’s almost the exact same size as my iPhone 15 but maybe half an inch thicker. It doesn’t feel cheap, it’s a good product. Nothing bad to say and no regrets from purchasing it.///Working great at 2 months///I recently purchased and Xbox X and knew I would need some rechargeable batteries. I ended up buying this 2 pack and have been impressed with how long they last. I played a few times a week and and have only switched these once or twice. I’ve recommended these to friends and their experiences have been similar.For the price, I find these hard to beat. Definitely go this route and skip buying regular batteries. The payback will be quick going this route for sure.If I could make one complaint, it would be the charging usb is too short. Kind of odd how short the wire is, but I found a good spot in my home. Otherwise, these are great"
