Producto,Precio,Estrellas,Link,Reseñas
"JLab Nightfall - Auriculares para juegos con micrófono giratorio giratorio de campo cercano para silenciar, controladores de 1.969 in y estante interior con aislamiento de sonido, cable de 0.138 in",US$39.99,4.2,https://www.amazon.com/-/es/sspa/click?ie=UTF8&spc=MTo1ODEzNTIzOTc2MjU0NDczOjE3MzEwNDA4NDA6c3BfYnRmOjMwMDEwMDQ5MzQwODQwMjo6MDo6&url=%2FJLab-Nightfall-Auriculares-controladores-aislamiento%2Fdp%2FB0CNS6CGMM%2Fref%3Dsr_1_19_sspa%3F__mk_es_US%3D%25C3%2585M%25C3%2585%25C5%25BD%25C3%2595%25C3%2591%26dib%3DeyJ2IjoiMSJ9.BhhlnlbXGtfp-fhLm1erHoKq6hoJBfMMmlPW2VhISqZoTcLyK1oRJshCX2CZIBBM5fJnWyfYy83GSnhSAIccSJcV8KMybl7_qGWAMh3SfegtcpdcFzzleGlgCS0GXLAR8jwN8UtnryW05r1RD6CBpcoaamwYL0U81Kg6fbdeiT8VG9JSKEJSUczcNb67Ywq7Kbi6GKkAiCZzUf2BRHbrtxHhPYCX1C_oc9JFzYqoe-8.kElLdiPKyAqPYCv3-RTVC7peNMAnjk6wpDx6k-SaPYk%26dib_tag%3Dse%26keywords%3Dxbox%26qid%3D1731040840%26sr%3D8-19-spons%26sp_csd%3Dd2lkZ2V0TmFtZT1zcF9idGY%26psc%3D1,"Decent little headset for the price///For the price theyre pretty good. Sounds good and i could hear everything i needed to hear, friends said the mic was pretty decent and they could hear me nice and clear on the other end. Seem to be pretty good material too, again given the price it should hold up dif you treat them like you paid for them.Pretty comfortable too, after a long night of origional zombies i never really noticed they were their. Light, ear cushions are nice and cushiony, headbands actually comfy and not as annoying as i thought it would be. Looooooong cord too, almost annoying long lol but gives you plenty of movement thats for sure.///It's a pretty solid headset (preferably as a backup but could be used as a main)///I have been using this head set for about a month now and it's a pretty durable headset with decent mic and speakers for a good price. I absolutely love the ear pads. When looking for a gaming head set I usually have an issue with the breathability of the headphones most of the time because my ears get too hot or the material makes me uncomfortable after prolonged use, but these were perfect. The speakers are great, I usually look for surround sound headphones for directional listening for games but this actually work just as good. Also music is pretty good although i haven't heard incredible bass from if your curious about that. I have only three major complaints, well not really complaints but fears I have regarding the velcro band that your head rests on, the mic and the wire. The velcro strap is pretty stretchy and comfortable but I'm kinda concerned about  it stretching out over time and the headset not sitting on my head properly and sliding all over the place. For the mic I'm not concerned about its sound quality, because as I said previously it's pretty good mic though what they said about the directional mic isn't really great I can still hear people in front of me from a distance in my audio's background and they aren't yelling or speaking loudly, another thing to consider when buying this. I'm also concerned with the life expectancy of the mic because it's a pull down to speak and push up to mute, I kinda worried about it breaking cause it's getting looser with my use. I also have problems with the aux cord when plugging it in to my laptop, tablet, or controller. Sometimes it acts like it isn't plugged in or makes static noises only heard by my teamates when I'm talking and gets worse when I have the mic up. But otherwise I say it's a pretty good set of gaming headphones for the price.Update: 7/3/2024The head phones started to have a static noises one one side of the headphones, the mic surprisingly didn't  have issues and as I feared the band started strech out and now it slides off my head pretty often.///Solid///The first pair that arrived did not work at all so I returned them and got a replacement. Second pair works find and I’m glad I got a replacement instead of asking for my money back.The most I game in a session is 2 hours and they are plenty comfortable for that amount of time. Haven’t had any complaints about mic quality. The quality of the plastic is pretty good. I’d recommend for the price.///Works great///Bought them for my wife , and she says the fit great and the sound is great. No complaints///Love it///The headband fit is so extremely comfortable and the ear sections are great for people with ear piercings that get compressed with other headphones. Can wear these for long gaming sessions and forget they are there! The muting feature is also amazing!///Actually Pretty Good but…///Pretty good sounding headset and comfortable too but I wish it had a mute button the only way to mute is to lift the mic up///Needs additional equipment to work on PC!///Nowhere in the product description did it mention it needed a separately purchased dual 3.5mm splitter for this to work with a PC. I know we're just talking about budget headphones and this didn't break my bank.. but I would have purchased the splitter at the time of the headphones instead of now having to go get one, or order one and continue to wait just to use headphones on the PC.///So impressed I bought a second pair///Overall, I've been very impressed with these headphones. They are some of the most comfortable gaming headphones I have owned. They have a reversable band that can be used as multicolored or black. They fit over my ears very comfortably. The mic works well without interference. I like that you can simply flip it up to mute it. It's very convenient during gaming, rather than a switch on the cord like others I have used. I have used the headset with my Xbox X and I have had no issues. Sound quality is very good with an easy to access volume scroll wheel. My husband used them a few times and liked them so much I bought him a pair. Overall, these are a great option for gaming headphones.///Excellent budget headset!///I'm so happy with these! For only $60 (CAD) this headset has it all.If you're looking at $40 headsets, spend another $20 (if you can) and get this one instead!It's comfortable, soft, eyeglasses friendly, does not squeeze my head. My ears fit inside the deep ear cups, they do not touch the hard part inside, and my glasses aren't being pushed around! Adjustable headband is stretchy and smooth.Sound quality is great for this price, too! You could happily listen to music on an iPod or your phone with these. They might not get as loud as an expensive Bluetooth headset but dude; for $60?! These are fantastic!The microphone is loud & clear, and it doesn't pick up sound from the headphones!I bought these for use on a smartphone mostly.I have tested the mic and sound on a phone call, in WhatsApp, and in Capcut. It all sounded better than I expected for a budget headset, and I didn't get background noise on my voice recordings.I'm told my microphone in the phone call came through surprisingly crisp and clear, way better than my phone's built-in mic.The braided cord is a really nice touch, and the set is so light! It weighs basically nothing.Because they're so light I wouldn't recommend letting them bounce around loosely in a bag, just treat them with care.Good job, JLAB! I'm gonna be using these all the time! 10/10! Thank you!///COMFY and great sound///Using these for ps5 and I love them so much. They're padded and extremely comfortable. Occasionally I use them for music and they sound pretty good too.///Audio correct mais micro médiocre///Booster le micro à 30dB pour entendre peu non merci… mais l’audio est bien mais Le micro ne vaut vraiment pas la peine, résultat final remboursement 😞"
"Upgraded Controller Charger Station with 2x5520mWh Rechargeable Battery Packs for Xbox One/Series X|S Controller,Dual Charging Dock for Xbox One Controller Battery Pack with 4 Battery Covers for Xbox",US$32.98,4.6,https://www.amazon.com/-/es/sspa/click?ie=UTF8&spc=MTo1ODEzNTIzOTc2MjU0NDczOjE3MzEwNDA4NDA6c3BfYnRmOjMwMDE2MTU0NzAzNTgwMjo6MDo6&url=%2FUpgraded-Controller-2x5520mWh-Rechargeable-Charging%2Fdp%2FB09MLSJHN2%2Fref%3Dsr_1_20_sspa%3F__mk_es_US%3D%25C3%2585M%25C3%2585%25C5%25BD%25C3%2595%25C3%2591%26dib%3DeyJ2IjoiMSJ9.BhhlnlbXGtfp-fhLm1erHoKq6hoJBfMMmlPW2VhISqZoTcLyK1oRJshCX2CZIBBM5fJnWyfYy83GSnhSAIccSJcV8KMybl7_qGWAMh3SfegtcpdcFzzleGlgCS0GXLAR8jwN8UtnryW05r1RD6CBpcoaamwYL0U81Kg6fbdeiT8VG9JSKEJSUczcNb67Ywq7Kbi6GKkAiCZzUf2BRHbrtxHhPYCX1C_oc9JFzYqoe-8.kElLdiPKyAqPYCv3-RTVC7peNMAnjk6wpDx6k-SaPYk%26dib_tag%3Dse%26keywords%3Dxbox%26qid%3D1731040840%26sr%3D8-20-spons%26sp_csd%3Dd2lkZ2V0TmFtZT1zcF9idGY%26psc%3D1,"Easy setup.///Easy setup, bought for my 6 year old for Christmas. Looks cool with the front lights and charges great. Have had it for over a year and it’s still working great.///Excellent rechargeable battery///This was easy to install and set up. The only issue was the battery fits very tight so make sure you completely snap it into place. At first the controllers didn't work because I didn't have the batteries completely seated. Once I figured that out they worked great.No performance issues. So far battery charge holds for about 16 to 18 hours of gaming. They fit fine on the charger cradle which I have plugged into the USB port on the Xbox Series X.I like the indicator light telling me when it's charging and when it's fully charged and it seems accurate so far. a big plus is how inexpensive this is compared to burning through AA batteries non stop.  Great value.///Works great!///No more dead batteries when I go to play Xbox! Just set the controller on the charger when you’re done and it’s always ready to go the next time you pick it up.///Works great///Purchased this to use it for the controller I use for my PC. It works great and the battery lasts a long time. The only thing I wish it had was a way to charge the secondary battery without a controller so that way if you needed to you could swap them out.///Does as advertised.///Put about forty hours on it already. No issues. Batteries fit like a glove. Charges like a champ. Highly satisfied. Would recommend.///Having issues charging?///If you are getting the fast blinking red light when you put the controller on the charger, try turning the battery so the arrow points in the other direction. The instructions were confusing about which direction to insert the battery, so initially I had mine pointing the wrong way. The controller worked fine, but would not charge on the charger, and I had the fast blinking red light indicating a charging issue. After I turned the battery the other way, all is good and the controller charges on the charger as expected.///Works great!///Product is great.  Not sure if I overlooked this detail but please note that it does not come with a box to plug it in!!///Great charger///Comes with black battery covers so you may need to drill holes in your custom battery covers///Sensacional///Exatamente como descrito.///Perfeito///A duração das baterias é de 43 horas de jogatina, muito bom.///Work good!///Good! Works very good so far after 2 monthsThe question with todays stuff, is always for how long///Durabilidade das baterias excelentes.///Base muito prática e simples de instalar. Baterias duráveis dando horas de diversão. Recomendo a todos."
"Estación de carga para control Xbox con batería recargable de 2 x 5520 mWh para controlador Xbox One/Xbox Series X/S, base de carga para controlador Xbox One con 4 cubiertas, accesorios para Xbox",US$32.99,4.8,https://www.amazon.com/-/es/sspa/click?ie=UTF8&spc=MTo1ODEzNTIzOTc2MjU0NDczOjE3MzEwNDA4NDA6c3BfYnRmOjMwMDUwNzI4ODk0MDEwMjo6MDo6&url=%2FEstaci%25C3%25B3n-recargable-controlador-cubiertas-accesorios%2Fdp%2FB0CSSJ2SPL%2Fref%3Dsr_1_21_sspa%3F__mk_es_US%3D%25C3%2585M%25C3%2585%25C5%25BD%25C3%2595%25C3%2591%26dib%3DeyJ2IjoiMSJ9.BhhlnlbXGtfp-fhLm1erHoKq6hoJBfMMmlPW2VhISqZoTcLyK1oRJshCX2CZIBBM5fJnWyfYy83GSnhSAIccSJcV8KMybl7_qGWAMh3SfegtcpdcFzzleGlgCS0GXLAR8jwN8UtnryW05r1RD6CBpcoaamwYL0U81Kg6fbdeiT8VG9JSKEJSUczcNb67Ywq7Kbi6GKkAiCZzUf2BRHbrtxHhPYCX1C_oc9JFzYqoe-8.kElLdiPKyAqPYCv3-RTVC7peNMAnjk6wpDx6k-SaPYk%26dib_tag%3Dse%26keywords%3Dxbox%26qid%3D1731040840%26sr%3D8-21-spons%26sp_csd%3Dd2lkZ2V0TmFtZT1zcF9idGY%26psc%3D1,"Works great///Apparently they give you 2 sets of back plates as the xbox one controllers are slight different from the xbox series controllers even though they both take the same battery. I missed the second set of covers for the xbox series controllers and thought there was a problem but then I found them and they fit my xbox series controller fine and the other ones fit my xbox one controller fine. Everything is working abd charging like it should.///Works perfectly with my Xbox Series S controllers.///My controllers easily fit on this charger perfectly even with the rubber case on them. At first I was gonna return this for a full refund cause I saw no matter how long I keep on charging them even with the light showing green, my Xbox Series S always shows the battery life as Medium, not full. Only much later I found out that this is normal for lots of 3rd party rechargeable batteries to never show up as 100% charged on other devices, even though the charger light is green meaning that it is 100% charged.So I've been using the controller with the pink rubber for the last 4 nights, and whenever I start the games on my Xbox Series S I always end up playing for at least 5 hours or more, and so far for the past four nights it still shows the battery life in my controller as medium, meaning that it's not even close to needing me to use the charger yet.  So in the end I was wrong for thinking that this charger is no good even though it really is.  I also like that this charger gives you the option to turn off the lights completely if you'd like after charging the controllers, and also you can turn off the lights on the bottom if you'd like and only the two lights on top will stay on to let you know when it's done, if you're still charging the controllers.///Looks and works great!///It looks awesome on my desk and charges great!///Great///Excellent product, battery’s last me 5 days of gaming with no charge and at least 3hrs per day///Easy to connect///All you need to do once you insert the battery is to set the controller on the base. I've had other models that you have to make adjustments once you place the controller. Great!!///Good product///The product looks cool and functions as advertised. I am skeptical how long the battery will last. They appear to be two AA batteries in a thin wrap not hard plastic. If they are put in the controllers and left alone I don't see any issues.///Keeps controllers charged///Not one change of batteries yet!///Great product!///Love it! Works well and zero issues! Keeps both controllers charged up! Batteries last a long time as well!"
"Powerextra Paquete de baterías de carga rápida para mando Xbox, 4 x 5520 mWh (2300 mAh) baterías recargables para mandos Xbox Series X/S/One X/S/Elite",US$24.99,4.5,https://www.amazon.com/-/es/sspa/click?ie=UTF8&spc=MTo4Mzg5MzI3NjU2NDUxNDc0OjE3MzEwNDA4NDI6c3BfYXRmX25leHQ6MzAwNDc4MTE4MTc1MDAyOjowOjo&url=%2FPowerextra-Paquete-bater%25C3%25ADas-r%25C3%25A1pida-recargables%2Fdp%2FB0D5QQ9L76%2Fref%3Dsr_1_17_sspa%3F__mk_es_US%3D%25C3%2585M%25C3%2585%25C5%25BD%25C3%2595%25C3%2591%26dib%3DeyJ2IjoiMSJ9.IovXGXt9jOGiVyX05d0RrfkAT_As_1vbAOmfdhiUUvnGjHj071QN20LucGBJIEps.V70UO1KbGQSSO5DAnRuIpvYGzR95dJiTxeXK-xkymhA%26dib_tag%3Dse%26keywords%3Dxbox%26qid%3D1731040842%26sr%3D8-17-spons%26sp_csd%3Dd2lkZ2V0TmFtZT1zcF9hdGZfbmV4dA%26psc%3D1,"Works great///I love it no problems///Charger works great and is super fast!///The Powerextra Fast Charger Battery Pack for Xbox Controllers is awesome! I used to burn through AA batteries in both my XB1 and Series X controllers for a long time. I have tried rechargeable kits, but the batteries take so long to recharge in the machines, that I end up having to use another set of AA's in between. I've also utilized other types of chargers/rechargeable batteries in the past, those batteries never lasted very long even when brand new, and charging took almost as long and you had to leave the batteries in the controller, which means the controller is now out of service and you could not even play with a wire attached.This system was designed the right way, with the option to charge the batteries without needing the full controller attached, and because it comes with 4, you have many options available to keep your game going on for a long time. Each individual battery fits the Xbox One and Series X/S controllers, and you do not need any fancy back plate replacement. The batteries slip right in and the controller turns on and you're good to go. Once the battery dies out, pop it into an open green slot, make sure to push it down until it clicks in and the light will turn red to show it is charging, when done it turns green and you're ready to go with that battery again.Upon receiving my charging kit, I placed all batteries in to see how long it would take and very shortly after placing them all on charge, the lights started turning green very quickly. I have been able to test one of the batteries so far to see what the full extent of life would be while playing a few different types of games that make the controller vibrate rather often to see how long it would take and the battery was still going past the 7.5 hour mark without charging it and with the controller only turning off briefly from being away. Once finished gaming for the day, I placed the battery back on the charger and I do not believe it was even 2 hours before the charger turned green again to show it was ready to use.This set up is convenient, it is easy to use as a travel set when gaming with friends on the go, and it a great asset to saving money and not wasting it on disposable batteries as often. The investment is worth it if gaming with an xbox controller if you primary controller whether on console or PC, it is just the way to go because you always have a fresh battery waiting to be utilized, or you can share with friends to keep them gaming in between their batteries being recharged. I'm truly excited to come across this setup and will be putting it to use full time as my new replacement to the older battery kits I've used and suggest for anyone one a budget, the small cost to purchase this up front will save you tons in the future for disposable batteries when your income is definitely not that disposable with all these price hikes on everyday items. Definitely a great item that will benefit gamers all around!///Convenient with a long play time///I’ve been using alkaline batteries to power my Xbox controllers, but that was getting expensive and bad for the environment. Then I started using AA NiMh batteries, but the capacity is small and I have to recharge them often, plus managing a set of AA batteries with a charger is cumbersome. I was interested in this set because the battery packs are neatly packaged together instead of loose AA batteries, and the charging base looks compact and I can leave it sitting next to my Xbox. The charging base can charge all 4 batteries at the same time, and comes with a USB-C charging cable but not an AC adapter.Out of the box, the batteries needed to be charged, so I plugged them all in, and it took a few hours for them to fully charge. The charging well for each battery lights up green when a battery is full and red when a battery is charging. I can see the lights from over ten feet away, so it is easy to tell when the batteries have finished charging.The new batteries only go in one way but easy to figure out. Make sure the printed side that says “Outside” is facing up, and the contact side of the battery goes in first, then the other end will just slide in. It won’t let you insert the battery the wrong way, so never force it.Overall, I like the extra capacity of these batteries, and they give a much longer play time. When the battery runs out, it is simple to swap out a fresh pack, making it very convenient. The charging base is small and unobtrusive, and looks right at home next to my Xbox. If you’re still using alkaline batteries, get this rechargeable set and you will never look back.///Long lasting, quick charging///This battery pack has a lot to like. The charge lasts longer than conventional batteries. The packs are rechargeable, and they are quick charging. The charger station is great! It holds the battery packs snugly in place while there is a red to green LED indicator lighting that shows when the packs are done charging.I use these with my XBox controllers. I get a lot of game time in before I have to switch out the batteries. At first, it might be a little tricky getting the battery pack mounted in the controller. It only fits one way, so once it gets figured out, it's no problem. They fit good once placed correctly. They are easy to remove.The power station uses USB-C as the power cable. The product description says that the battery station and power packs are good for 2,000+ charges. That seems about the going rate for similar products.These packs work well, and I am impressed with the long battery life. It comes with four battery packs, and each fit well with my controllers. The price seems fair. It's been a good product so far. Recommended.///Works great///Prefect for my gamer. Battery life lasts long. Charges quite quick.///So far working great///Xbox controllers go through too many AA’s so we have been trying the rechargeable kind to varying degrees of success. So far these ones are working great.-They came in very well packaged and everything was accounted for.-They came in partially charged so they didn’t take long to reach full charge the first time.-They are a bit tight getting them in the battery compartment but that just means if you don’t put the battery cover on they will still stay in.-As you can see these are the type that charge outside the controller which has a benefit of its own. Instead of having to put your controller down to charge you can just switch the battery.-The fact that these work for several types of controllers is very nice as opposed to the crazy specific other ones we have tried.- They also stay pretty cool and don’t overheat so far.-So far they last at least as long as advertised.Overall I am very happy with the quality of these and the fact we are going through less AA batteries."
"Teclado para juegos con junta inalámbrica 75% con pantalla y perilla, 3 modos, teclado mecánico compacto de intercambio en caliente, teclado cremoso RGB, teclas PBT para PC/tablet/PS/Xbox",US$79.66,Ent,https://www.amazon.com/-/es/sspa/click?ie=UTF8&spc=MTo4Mzg5MzI3NjU2NDUxNDc0OjE3MzEwNDA4NDI6c3BfYXRmX25leHQ6MzAwNDg2NDY5NjQxMDAyOjowOjo&url=%2Final%25C3%25A1mbrica-pantalla-mec%25C3%25A1nico-compacto-intercambio%2Fdp%2FB0DFMPGY7C%2Fref%3Dsr_1_18_sspa%3F__mk_es_US%3D%25C3%2585M%25C3%2585%25C5%25BD%25C3%2595%25C3%2591%26dib%3DeyJ2IjoiMSJ9.IovXGXt9jOGiVyX05d0RrfkAT_As_1vbAOmfdhiUUvnGjHj071QN20LucGBJIEps.V70UO1KbGQSSO5DAnRuIpvYGzR95dJiTxeXK-xkymhA%26dib_tag%3Dse%26keywords%3Dxbox%26qid%3D1731040842%26sr%3D8-18-spons%26sp_csd%3Dd2lkZ2V0TmFtZT1zcF9hdGZfbmV4dA%26psc%3D1,
